municipio,prefeito,vice_prefeito,partido,numero,votos_prefeito,percentual_prefeito,segundo_colocado,partido_segundo_colocado,votos_segundo_colocado,percentual_segundo_colocado,margem_vitoria_votos,margem_vitoria_pct,status_extracao,arquivo_origem
Anadia,PAULO VICTOR PEREIRA ROCHA,EDIRAJAR FALCÃO PEDROSA JÚNIOR,PP,11,5446,54.0,AMÓS DE ALMEIDA ROCHA,PSB,4639.0,46.0,807.0,8.0,OK,619_AL_ANADIA_2024_T1.pdf
Arapiraca,JOSE LUCIANO BARBOSA DA SILVA,RUTINEIDE PEREIRA MELO DE LIRA,MDB,15,100890,85.04,FABIANA CAVALCANTE PESSOA,PL,16635.0,14.02,84255.0,71.02000000000001,OK,619_AL_ARAPIRACA_2024_T1.pdf
Atalaia,CECILIA LIMA HERRMANN,NICOLLAS VON MEYNARD THEOTONIO COSTA,MDB,15,19600,79.95,MAURICIO TENÓRIO DA SILVA,PDT,2423.0,9.88,17177.0,70.07000000000001,OK,619_AL_ATALAIA_2024_T1.pdf
Barra De Santo Antônio,LIVIA CARLA DA SILVA ALVES,LUCAS MARTINS ALVES,REPUBLICANOS,10,7647,60.88,EMANUELLA CORADO ACIOLI DE MOURA,MDB,4843.0,38.56,2804.0,22.32,OK,619_AL_BARRA-DE-SANTO-ANTÔNIO_2024_T1.pdf
Barra De São Miguel,BENEDITO DE LIRA,LUIZ HENRIQUE LIMA ALVES PINTO,PP,11,4563,68.12,FLORIANO DE ALBUQUERQUE MELO NETO,MDB,2135.0,31.88,2428.0,36.24000000000001,OK,619_AL_BARRA-DE-SÃO-MIGUEL_2024_T1.pdf
Batalha,WAGNEY DANTAS CORREIA CAJE,IZAIAS GOMES BEZERRA,MDB,15,6951,64.39,ALEX SANDRO ROCHA PINTO,PP,2791.0,25.85,4160.0,38.54,OK,619_AL_BATALHA_2024_T1.pdf
Belo Monte,DALMO AUGUSTO DE ALMEIDA JÚNIOR,ANTONIO JEREMIAS FEITOSA,MDB,15,3882,79.79,MARIANA LIMA SILVA,REPUBLICANOS,983.0,20.21,2899.0,59.580000000000005,OK,619_AL_BELO-MONTE_2024_T1.pdf
Belém,ADALBERTO ANTERO TORRES,JOSÉ ADRIANO DA SILVA,PP,11,2568,68.55,LUIZ HENRIQUE DAMASCENO SURUAGY,PSB,1178.0,31.45,1390.0,37.099999999999994,OK,619_AL_BELÉM_2024_T1.pdf
Boca Da Mata,BRUNO FEIJÓ TEIXEIRA,SERGIO MACIEL DA COSTA,PP,11,9227,61.4,AMANDA LARISSA BARROS ACIOLI DE MOURA,PSB,5801.0,38.6,3426.0,22.799999999999997,OK,619_AL_BOCA-DA-MATA_2024_T1.pdf
Branquinha,RAIMUNDO JOSÉ DE FREITAS LOPES,RENATO ANTONIO LIMA DA PURIFICAÇÃO,MDB,15,6115,100.0,,,,,,,OK,619_AL_BRANQUINHA_2024_T1.pdf
Cacimbinhas,WLADIMIR ARAÚJO WANDERLEY,MIRABEAU AMORIM MADEIROS,MDB,15,6336,100.0,,,,,,,OK,619_AL_CACIMBINHAS_2024_T1.pdf
Cajueiro,LUCILA RÉGIA ALBUQUERQUE TOLEDO,ANTONIO JORGE DE MELO JUNIOR,MDB,15,5969,53.82,WELINGTON NEMESIO DE LIMA,PP,4610.0,41.57,1359.0,12.25,OK,619_AL_CAJUEIRO_2024_T1.pdf
Campestre,NELSON MENDES DA SILVA NETO,JOSIAS ANTONIO DA SILVA,MDB,15,3449,68.87,DEBSON BRASILIANO DA SILVA,PP,1559.0,31.13,1890.0,37.74000000000001,OK,619_AL_CAMPESTRE_2024_T1.pdf
Campo Alegre,PAULINE DE FÁTIMA PEREIRA ALBUQUERQUE,LEONARDO DE PAULA MONTEIRO,PP,11,12217,59.17,HENRIQUE ANTONIO DE GOES TENORIO,MDB,8429.0,40.83,3788.0,18.340000000000003,OK,619_AL_CAMPO-ALEGRE_2024_T1.pdf
Campo Grande,TEOGENES HIGINO MELO LESSA,JOSE ROSENDO DOS SANTOS,PSB,40,4335,57.75,EDINALDO LIMA DOS SANTOS,REPUBLICANOS,3058.0,40.74,1277.0,17.009999999999998,OK,619_AL_CAMPO-GRANDE_2024_T1.pdf
Canapi,JOSÉLIA MELO DE LIMA,HERMESON MELO DE LIMA,PP,11,7399,61.55,LARA JAYNE SIQUEIRA BARBOSA MALTA BRANDÃO,PT,4384.0,36.47,3015.0,25.08,OK,619_AL_CANAPI_2024_T1.pdf
Capela,THIAGO DE MEDEIROS MOURA,ANIBAL SORIANO MOREIRA,MDB,15,6085,58.07,FERNANDO ANTONIO LUCENA MALTA,PL,4394.0,41.93,1691.0,16.14,OK,619_AL_CAPELA_2024_T1.pdf
Carneiros,UBIRATANIA MARIA SANTANA,JANAÍNE SOARES MACHADO,MDB,15,4002,67.29,GENIVALDO NOVAIS AGRA,REPUBLICANOS,1945.0,32.71,2057.0,34.580000000000005,OK,619_AL_CARNEIROS_2024_T1.pdf
Chã Preta,MAURICIO DE VASCONCELOS HOLANDA,VICTOR SALVIO CANUTO TEIXEIRA,MDB,15,3892,69.38,MARYELLY CAVALCANTE DA SILVA,PSB,1718.0,30.62,2174.0,38.75999999999999,OK,619_AL_CHÃ-PRETA_2024_T1.pdf
Coité Do Nóia,BUENO HIGINO DE SOUZA SILVA,JOSÉ TELMO BARBOSA,PP,11,5687,73.93,JOSÉ DE SENA NETTO,MDB,2005.0,26.07,3682.0,47.86000000000001,OK,619_AL_COITÉ-DO-NÓIA_2024_T1.pdf
Colônia Leopoldina,ALEXANDRE GILBERTO SOBREIRA,LUCIANA MEDEIROS DE LUNA FREITAS,MDB,15,5995,51.67,DAVID MARIO FEITOSA JARDIM,PL,4269.0,36.8,1726.0,14.870000000000005,OK,619_AL_COLÔNIA-LEOPOLDINA_2024_T1.pdf
Coqueiro Seco,JADIELSON SILVA DO NASCIMENTO,JOEL BONFIM,MDB,15,2295,48.83,RONALDO ALEXANDRE SILVA DOS SANTOS,PDT,2150.0,45.74,145.0,3.0899999999999963,OK,619_AL_COQUEIRO-SECO_2024_T1.pdf
Coruripe,MARCELO BELTRÃO SIQUEIRA,JOSÉ ENEAS DA COSTA GAMA,PP,11,27647,90.22,MARCOS ANTONIO LINS DOS SANTOS,23,2303.0,7.52,25344.0,82.7,OK,619_AL_CORURIPE_2024_T1.pdf
Craíbas,TEÓFILO JOSÉ BARROSO PEREIRA,SEBASTIÃO BARBOSA DA SILVA,PP,11,11286,61.4,EDIEL BARBOSA LIMA,MDB,7095.0,38.6,4191.0,22.799999999999997,OK,619_AL_CRAÍBAS_2024_T1.pdf
Delmiro Gouveia,ELIZIANE FERREIRA COSTA LIMA,ERIVALDO BEZERRA SANDES,MDB,15,24620,83.31,CRISTOVÃO LOPES DIAS,PT,4932.0,16.69,19688.0,66.62,OK,619_AL_DELMIRO-GOUVEIA_2024_T1.pdf
Dois Riachos,ROZINEIDE BARBOSA DE ARAÚJO CAMILO,JORGE VIEIRA DE MENEZES JUNIOR,MDB,15,4470,59.05,ROSIVAN RODRIGUES DA SILVA JUNIOR,PSB,3100.0,40.95,1370.0,18.099999999999994,OK,619_AL_DOIS-RIACHOS_2024_T1.pdf
Estrela De Alagoas,ROBERTO FERREIRA WANDERLEY,CICERO PINHEIRO DA SILVA,MDB,15,5538,57.72,ARLINDO GARROTE DA SILVA NETO,PP,4057.0,42.28,1481.0,15.439999999999998,OK,619_AL_ESTRELA-DE-ALAGOAS_2024_T1.pdf
Feira Grande,DÁRIO ROBERTO SILVA LIRA,ROMARIO DA SILVA SANTOS,MDB,15,10095,63.58,CRISTHIAN MESSIAS DE OLIVEIRA LIRA,PP,5782.0,36.42,4313.0,27.159999999999997,OK,619_AL_FEIRA-GRANDE_2024_T1.pdf
Feliz Deserto,JORGE LUIS SILVA NUNES,JOAO PAULO DOS SANTOS SOUZA,PP,11,1918,56.23,DOUGLAS CASTRO SIMÕES LESSA,REPUBLICANOS,1395.0,40.9,523.0,15.329999999999998,OK,619_AL_FELIZ-DESERTO_2024_T1.pdf
Flexeiras,SILVANA MARIA CAVALCANTE DA COSTA PINTO,SHEILA CALHEIROS MAGALHAES SAMPAIO,PP,11,4867,72.59,BRUNO LOUREIRO FRAGOSO,MDB,1838.0,27.41,3029.0,45.18000000000001,OK,619_AL_FLEXEIRAS_2024_T1.pdf
Girau Do Ponciano,GILBERTO BEZERRA BARROS,OSVALDO ALEXANDRE SANTOS JUNIOR,PP,11,15885,71.42,LIDIA SAMYRA DO NASCIMENTO BARROS SILVA,PDT,6358.0,28.58,9527.0,42.84,OK,619_AL_GIRAU-DO-PONCIANO_2024_T1.pdf
Ibateguara,MANOEL GERAERTES ALVES CRUZ,FRANCISCO DE ASSIS LEAL,MDB,15,6657,75.79,EDJA MARIA CAVALCANTI SANTOS DE SÁ,PL,2126.0,24.21,4531.0,51.580000000000005,OK,619_AL_IBATEGUARA_2024_T1.pdf
Igaci,JOSE PETRUCIO OLIVEIRA BARBOSA,JOSENILDO GOMES DE FRANÇA,MDB,15,10377,68.81,ALBERES CANDIDO DA SILVA,UNIÃO,4704.0,31.19,5673.0,37.620000000000005,OK,619_AL_IGACI_2024_T1.pdf
Igreja Nova,TIAGO GOMES DOS SANTOS,EDVALDO CAVALCANTE,MDB,15,7230,51.17,GERALDO NUNES CADETE NETO,UNIÃO,6703.0,47.44,527.0,3.730000000000004,OK,619_AL_IGREJA-NOVA_2024_T1.pdf
Inhapi,LUIZ CELSO MALTA BRANDÃO FILHO,GILSON TENÓRIO CAVALCANTE,PP,11,9646,89.91,WELLINGTON PETRONIO MENEZES FREIRE,PDT,917.0,8.55,8729.0,81.36,OK,619_AL_INHAPI_2024_T1.pdf
Jacaré Dos Homens,MARIA DO SOCORRO MELO DA SILVA,FRANKLIN DANTAS CORREIA CAJÉ,MDB,15,2574,56.95,JOSE ERNESTO SILVA JUNIOR,PP,1946.0,43.05,628.0,13.900000000000006,OK,619_AL_JACARÉ-DOS-HOMENS_2024_T1.pdf
Jacuípe,MAYARA CRISTINA CAVALCANTE DE FREITAS,JOSE SEVERINO DA SILVA,MDB,15,3718,73.58,MARCOS VINICIUS DA SILVA FERREIRA,PP,1335.0,26.42,2383.0,47.16,OK,619_AL_JACUÍPE_2024_T1.pdf
Japaratinga,JOSÉ SEVERINO DA SILVA,JAILTON DOS SANTOS,MDB,15,4957,64.14,MARIA HELENA CALAÇA CARVALHO,PSB,2771.0,35.86,2186.0,28.28,OK,619_AL_JAPARATINGA_2024_T1.pdf
Jaramataia,RICARDO MARTINS BARBOSA,JOSÉ ELIOMAR BARBOSA,MDB,15,3527,100.0,,,,,,,OK,619_AL_JARAMATAIA_2024_T1.pdf
Jequiá Da Praia,CARLOS FELIPE CASTRO JATOBA LINS,LIDIA VIRGÍNIA MENDONÇA CURVELLO BELTRÃO,PP,11,5250,73.54,MARIA JOSE ALVES ANANIAS,PL,983.0,13.77,4267.0,59.77000000000001,OK,619_AL_JEQUIÁ-DA-PRAIA_2024_T1.pdf
Joaquim Gomes,ELIAS JOSE DA SILVA,JOSE MARCELINO DA SILVA,PSB,40,5172,44.33,,,,,,,OK,619_AL_JOAQUIM-GOMES_2024_T1.pdf
Jundiá,JORGE SILVIO LUENGO GALVÃO,LIELSON ELIAS BOMFIM,MDB,15,2927,73.51,BEROALDO RUFINO DA SILVA,PL,1055.0,26.49,1872.0,47.02000000000001,OK,619_AL_JUNDIÁ_2024_T1.pdf
Junqueiro,CICERO LEANDRO PEREIRA DA SILVA,JADER TIAGO DA SILVA,MDB,15,8805,54.46,JOÃO JOSÉ PEREIRA FILHO,PP,7337.0,45.38,1468.0,9.079999999999998,OK,619_AL_JUNQUEIRO_2024_T1.pdf
Lagoa Da Canoa,EDILZA ALVES DE SOUZA,JADIELSON TAVARES RODRIGUES,PP,11,7948,94.68,JARBAS GOMES DE BARROS PEREIRA LOPES,PSD,447.0,5.32,7501.0,89.36000000000001,OK,619_AL_LAGOA-DA-CANOA_2024_T1.pdf
Limoeiro De Anadia,JAMES MARLAN FERREIRA BARBOSA,FELIPE SOARES DE OLIVEIRA,PP,11,11438,69.54,SIDNEY VIEIRA DE SOUZA,REPUBLICANOS,3156.0,19.19,8282.0,50.35000000000001,OK,619_AL_LIMOEIRO-DE-ANADIA_2024_T1.pdf
Maceió,JOAO HENRIQUE HOLANDA CALDAS,RODRIGO SANTOS CUNHA,PL,22,379544,83.25,RAFAEL DE GÓES BRITO,MDB,58084.0,12.74,321460.0,70.51,OK,619_AL_MACEIÓ_2024_T1.pdf
Major Isidoro,THEOBALDO CAVALCANTI LINS NETTO,ITALO TAVARES SURUAGY DO AMARAL,MDB,15,7400,60.96,ERALDO DOS SANTOS LIMA,PP,4739.0,39.04,2661.0,21.92,OK,619_AL_MAJOR-ISIDORO_2024_T1.pdf
Mar Vermelho,ANDRÉ BRANDÃO DE ALMEIDA,HERMANN ELSON DE ALMEIDA FILHO,MDB,15,2540,100.0,,,,,,,OK,619_AL_MAR-VERMELHO_2024_T1.pdf
Maragogi,DANIEL MENDES DE VASCONCELOS FERREIRA,JOAO ENIO VASCONCELOS CAVALCANTE,PP,11,9877,49.04,MARCOS JOSÉ DIAS VIANA,MDB,9003.0,44.7,874.0,4.339999999999996,OK,619_AL_MARAGOGI_2024_T1.pdf
Maravilha,ANTÔNIO JORGE RODRIGUES,CARLOS LUIZ MARTINS MARQUES,REPUBLICANOS,10,3824,54.88,JAMIS LUIT SANTANA DOS SANTOS,PP,3144.0,45.12,680.0,9.760000000000005,OK,619_AL_MARAVILHA_2024_T1.pdf
Marechal Deodoro,ANDRÉ LUIZ BARROS DA SILVA,NEILSON COSTA DA SILVA,MDB,15,21621,58.47,JOSÉ GILVAN RIBEIRO DE ALMEIDA FILHO,REPUBLICANOS,15360.0,41.53,6261.0,16.939999999999998,OK,619_AL_MARECHAL-DEODORO_2024_T1.pdf
Maribondo,BRUNO ZEFERINO DO CARMO TEIXEIRA,JOSÉ UBIRATAN FERREIRA NUNES,PSB,40,5081,56.41,JORGE ANTÔNIO AMORIM MARQUES LUZ,PP,3927.0,43.59,1154.0,12.819999999999993,OK,619_AL_MARIBONDO_2024_T1.pdf
Mata Grande,MARIA FABIANA FARIAS DE ALENCAR,VINICIUS CAMPOS BRANDÃO CARVALHO,MDB,15,7728,53.97,WALLYSSON FIRMO DE HOLANDA SOARES,PSB,6591.0,46.03,1137.0,7.939999999999998,OK,619_AL_MATA-GRANDE_2024_T1.pdf
Matriz De Camaragibe,FERNANDO HENRIQUE LIMA CAVALCANTE,CLAUDIO RAMON SILVA DANTAS,MDB,15,10842,75.52,MARCOS PAULO DO NASCIMENTO,PP,3208.0,22.34,7634.0,53.17999999999999,OK,619_AL_MATRIZ-DE-CAMARAGIBE_2024_T1.pdf
Messias,MARCOS JOSÉ HERCULANO DA SILVA,MARCOS VALÉRIO DOS SANTOS,REPUBLICANOS,10,7223,62.13,JARBAS MAYA DE OMENA FILHO,PP,3407.0,29.31,3816.0,32.82000000000001,OK,619_AL_MESSIAS_2024_T1.pdf
Minador Do Negrão,JOSIAS SOARES DA SILVA,HELDER ARAUJO SOUZA BARROS,MDB,15,2702,63.56,JOSE EMILIO TENORIO BARROS,PSB,1549.0,36.44,1153.0,27.120000000000005,OK,619_AL_MINADOR-DO-NEGRÃO_2024_T1.pdf
Monteirópolis,LEONOR MELO MONTEIRO,FABIO MARCELO MONTEIRO JÚNIOR,MDB,15,2863,57.92,LIDIA DIELLY SILVA SANTOS,PODE,2080.0,42.08,783.0,15.840000000000003,OK,619_AL_MONTEIRÓPOLIS_2024_T1.pdf
Murici,REMI VASCONCELOS CALHEIROS FILHO,DAYVIDSON TENÓRIO VASCONCELOS,MDB,15,10363,66.01,EDUARDO CESAR DE OLIVEIRA,PP,4338.0,27.63,6025.0,38.38000000000001,OK,619_AL_MURICI_2024_T1.pdf
Novo Lino,MARCELA SILVA GOMES DE BARROS,RIVALDO DA SILVA GOMES,MDB,15,5935,75.24,JOSE EDUARDO DOS SANTOS SALES,PL,1953.0,24.76,3982.0,50.47999999999999,OK,619_AL_NOVO-LINO_2024_T1.pdf
Olho D'Água Das Flores,JOSÉ LUIZ VASCONCELLOS DOS ANJOS,CLEMENS SANTANA MACHADO,MDB,15,8611,70.26,ALYSON FELIX DUARTE DANTAS,PL,3400.0,27.74,5211.0,42.52000000000001,OK,619_AL_OLHO-D'ÁGUA-DAS-FLORES_2024_T1.pdf
Olho D'Água Do Casado,CARLOS ALBERTO BEZERRA DA SILVA,JOÃO DE DEUS DIAS DOS SANTOS,PT,13,3267,53.46,MARCOS VIEIRA SOUSA,MDB,2403.0,39.32,864.0,14.14,OK,619_AL_OLHO-D'ÁGUA-DO-CASADO_2024_T1.pdf
Olho D'Água Grande,MARIA SUZANICE HIGINO BAHÉ,WILLAMARA SOUSA DA SILVA,PP,11,2813,63.27,TEREZA DE FATIMA BARBOSA CEDRIM,REPUBLICANOS,1633.0,36.73,1180.0,26.540000000000006,OK,619_AL_OLHO-D'ÁGUA-GRANDE_2024_T1.pdf
Olivença,JOSIMAR DIONISIO,MAURO FERNANDES DA SILVA,MDB,15,4857,59.37,JORGINALDO VIEIRA DE MENESES,REPUBLICANOS,3324.0,40.63,1533.0,18.739999999999995,OK,619_AL_OLIVENÇA_2024_T1.pdf
Ouro Branco,TACIA DENYSE DE SIQUEIRA NOBRE,JOSE ROBERIO DA SILVA,PP,11,5480,67.21,ATEVALDO CABRAL SILVA,MDB,2673.0,32.79,2807.0,34.419999999999995,OK,619_AL_OURO-BRANCO_2024_T1.pdf
Palestina,JOSÉ DJALMA GONÇALVES DA SILVA,ONOFRE COSTA DA SILVA,MDB,15,3292,83.17,DINO CÉSAR DO NASCIMENTO,PP,666.0,16.83,2626.0,66.34,OK,619_AL_PALESTINA_2024_T1.pdf
Palmeira Dos Índios,LUISA JULIA DUARTE,SHEILA MARIA DUARTE,MDB,15,23994,57.43,MOSABELLE RODRIGUES BRASILEIRO MONTEIRO,REPUBLICANOS,13192.0,31.57,10802.0,25.86,OK,619_AL_PALMEIRA-DOS-ÍNDIOS_2024_T1.pdf
Pariconha,ANTONIO TELMO NOIA,MARIA DE FATIMA FARIAS DE PAULA CARVALHO,MDB,15,4892,67.08,PEDRO PEREIRA DE SÁ JUNIOR,PT,2401.0,32.92,2491.0,34.16,OK,619_AL_PARICONHA_2024_T1.pdf
Paripueira,CARLOS ABRAHÃO GOMES DE MOURA,CARLOS AUGUSTO SOUSA DE CASTRO,MDB,15,7170,70.08,EDVANIO DE LIMA SANTOS,REPUBLICANOS,3061.0,29.92,4109.0,40.16,OK,619_AL_PARIPUEIRA_2024_T1.pdf
Passo De Camaragibe,ELLISSON SANTOS DA SILVA,ADEILDO PETRÚCIO DOS SANTOS,REPUBLICANOS,10,6934,67.44,MARIA LAVÍNIA FARIAS QUIRINO COSTA,MDB,3347.0,32.56,3587.0,34.879999999999995,OK,619_AL_PASSO-DE-CAMARAGIBE_2024_T1.pdf
Paulo Jacinto,FRANCISCO MANOEL FERREIRA FONTAN,MARIA ZILDA DE ASSUNÇÃO TENÓRIO,PP,11,3233,59.8,FABRICIO BERTO FAUSTINO,PSB,2173.0,40.2,1060.0,19.599999999999994,OK,619_AL_PAULO-JACINTO_2024_T1.pdf
Penedo,RONALDO PEREIRA LOPES,JOSÉ EVALDO DOS SANTOS MONTEIRO,MDB,15,24059,71.33,MARCIUS BELTRÃO SIQUEIRA,PDT,9672.0,28.67,14387.0,42.66,OK,619_AL_PENEDO_2024_T1.pdf
Piaçabuçu,RYMES MARINHO LESSA,CARLOS RONALSA BELTRAO COELHO DA PAZ,MDB,15,5010,42.53,KAYRO CRISTÓVÃO CASTRO DOS SANTOS,PP,3627.0,30.79,1383.0,11.740000000000002,OK,619_AL_PIAÇABUÇU_2024_T1.pdf
Pilar,MARIA DE FATIMA RESENDE ROCHA OITICICA,TAYRONNE HENRIQUE DOS SANTOS,MDB,15,13008,56.14,ROBERTO DOUGLAS DA SILVA BARROS,PV,5171.0,22.32,7837.0,33.82,OK,619_AL_PILAR_2024_T1.pdf
Pindoba,JOSÉ CICERO CARDOSO COSTA,JOÃO MARÇAL LOPES BELTRÃO,REPUBLICANOS,10,1785,69.13,JOSÉ MAURICIO TENÓRIO CAVALCANTE,PP,797.0,30.87,988.0,38.25999999999999,OK,619_AL_PINDOBA_2024_T1.pdf
Piranhas,TIAGO TORRES FREITAS,JOSE VICENTE RODRIGUES,MDB,15,11565,76.07,MARISTELA SENA DIAS,PP,3638.0,23.93,7927.0,52.13999999999999,OK,619_AL_PIRANHAS_2024_T1.pdf
Porto Calvo,ERONITA SPOSITO LEAO E LIMA,VÍNICIUS LEAO E LIMA CARVALHO,MDB,15,12829,74.18,KLEVISSON KENNEDY DA SILVA SIQUEIRA,PP,3352.0,19.38,9477.0,54.80000000000001,OK,619_AL_PORTO-CALVO_2024_T1.pdf
Porto De Pedras,ALLAN DE JESUS SILVA,EUDA SANTOS SILVA,MDB,15,3691,51.25,LUIZ CARLOS BORGHETTI ROCHA,PP,3497.0,48.56,194.0,2.6899999999999977,OK,619_AL_PORTO-DE-PEDRAS_2024_T1.pdf
Porto Real Do Colégio,HIGOR JOSÉ SANTOS FREITAS,JOSE DE OLIVEIRA,PP,11,9439,66.34,JOSÉ TIAGO DE LIRA,PSB,4790.0,33.66,4649.0,32.68000000000001,OK,619_AL_PORTO-REAL-DO-COLÉGIO_2024_T1.pdf
Poço Das Trincheiras,JOSE VALMIRO GOMES DA COSTA,JOSE ERIVAN RAMOS DA SILVA,MDB,15,3961,44.18,CAIO CÉSAR FERREIRA RODRIGUES,PP,2552.0,28.47,1409.0,15.71,OK,619_AL_POÇO-DAS-TRINCHEIRAS_2024_T1.pdf
Pão De Açúcar,JORGE SILVA DANTAS,ERALDO JOÃO CRUZ ALMEIDA,MDB,15,10379,74.83,ALDO ALVES ROSA,PL,3035.0,21.88,7344.0,52.95,OK,619_AL_PÃO-DE-AÇÚCAR_2024_T1.pdf
Quebrangulo,MANOEL COSTA TENÓRIO,ALFREDO FREDERICO MEDEIROS MAIA FILHO,PSDB,45,2964,36.01,EMANOEL CARDOSO DE ALBUQUERQUE,MDB,2959.0,35.95,5.0,0.05999999999999517,OK,619_AL_QUEBRANGULO_2024_T1.pdf
Rio Largo,PEDRO CARLOS DA SILVA NETO,PETERSON HENRIQUE DA SILVA SANTOS,PP,11,32496,62.99,ANNY IZABELLE TORRES MELO LINS DE SOUZA,PDT,10848.0,21.03,21648.0,41.96,OK,619_AL_RIO-LARGO_2024_T1.pdf
Roteiro,PAULO JOSÉ LEITE TEIXEIRA,JOSIVALDO AUGUSTO DA SILVA,MDB,15,2537,52.41,THIAGO HENRIQUE TEIXEIRA CURSINO,PL,2238.0,46.23,299.0,6.18,OK,619_AL_ROTEIRO_2024_T1.pdf
Santa Luzia Do Norte,FRANCIS CORREIA BARROS DE ARAÚJO,LAUDEMIR BALBINO DOS SANTOS,PP,11,3300,60.07,WERDLEY THIAGO SILVA AMARAL,MDB,2138.0,38.92,1162.0,21.15,OK,619_AL_SANTA-LUZIA-DO-NORTE_2024_T1.pdf
Santana Do Ipanema,JOAO EDUARDO BULHOES PORTELA DE MELO,MÁRIO SIQUEIRA SILVA,MDB,15,16302,64.77,JOSE EDSON MAGALHÃES FELIX,PP,8268.0,32.85,8034.0,31.919999999999995,OK,619_AL_SANTANA-DO-IPANEMA_2024_T1.pdf
Santana Do Mundaú,ANDRÉ LUIZ GOES CASTRO,TARCISIO DE MORAIS ARAUJO,MDB,15,5322,72.96,EDNO LINO DA SILVA,PL,1972.0,27.04,3350.0,45.919999999999995,OK,619_AL_SANTANA-DO-MUNDAÚ_2024_T1.pdf
Satuba,DIOGENES JOSÉ NETO DE AMORIM,LUIS CARLOS ALVES DE LIRA,PP,11,12047,100.0,,,,,,,OK,619_AL_SATUBA_2024_T1.pdf
Senador Rui Palmeira,JOÃO CARLOS RODRIGUES,ALLYSSON FEITOSA DA SILVA,MDB,15,4778,62.64,JACKSON DA ROCHA CORDEIRO JÚNIOR,PP,2566.0,33.64,2212.0,29.0,OK,619_AL_SENADOR-RUI-PALMEIRA_2024_T1.pdf
São Brás,KLINGER QUIRINO SANTOS,MARIA FABIANA DA SILVA SANDES,MDB,15,4123,67.17,JOÃO BEZERRA BORGES,PP,1917.0,31.23,2206.0,35.94,OK,619_AL_SÃO-BRÁS_2024_T1.pdf
São José Da Laje,ANGELA VANESSA ROCHA PEREIRA BEZERRA,RAVENA GRAZYELLE VALENÇA CALDEIRA DE ARAÚJO,MDB,15,8144,61.03,FABRÍCIA REGINA PEDROSA VÉRAS,PL,5200.0,38.97,2944.0,22.060000000000002,OK,619_AL_SÃO-JOSÉ-DA-LAJE_2024_T1.pdf
São José Da Tapera,JARBAS PEREIRA RICARDO,JARIA PEREIRA RICARDO,MDB,15,11679,68.49,JOSE ROMARIO RODRIGUES PEREIRA,PDT,5248.0,30.78,6431.0,37.709999999999994,OK,619_AL_SÃO-JOSÉ-DA-TAPERA_2024_T1.pdf
São Luís Do Quitunde,MARCIA RAFAELA BARROS DE VASCONCELOS,CRISTOPHANES JACQUES UCHOA DE LIMA,MDB,15,10379,55.79,VIVIANE DOS SANTOS SILVA,PP,8225.0,44.21,2154.0,11.579999999999998,OK,619_AL_SÃO-LUÍS-DO-QUITUNDE_2024_T1.pdf
São Miguel Dos Campos,GEORGE CLEMENTE VIEIRA,BENILDO CHAGAS DE OMENA,MDB,15,25796,79.18,PEDRO RICARDO ALVES JATOBÁ,PRD,6782.0,20.82,19014.0,58.36000000000001,OK,619_AL_SÃO-MIGUEL-DOS-CAMPOS_2024_T1.pdf
São Miguel Dos Milagres,JADSON LESSA DOS SANTOS,JARIO ANTONIO DOS SANTOS,MDB,15,4014,58.36,RUBENS FELISBERTO DE ATAIDE JUNIOR,PSB,2864.0,41.64,1150.0,16.72,OK,619_AL_SÃO-MIGUEL-DOS-MILAGRES_2024_T1.pdf
São Sebastião,CHARLES NUNES REGUEIRA,ANA PATRICIA ALVES DOS SANTOS,PP,11,11980,56.14,MARCOS ANDRE DE JESUS PEREIRA,MDB,8803.0,41.26,3177.0,14.880000000000003,OK,619_AL_SÃO-SEBASTIÃO_2024_T1.pdf
Tanque D'Arca,JUVENIL LOPES DE OLIVEIRA,JEAN CEGALAN SANTOS DE LIMA,MDB,15,2326,50.71,ADRIANA WANDERLEY DOS SANTOS,REPUBLICANOS,2261.0,49.29,65.0,1.4200000000000017,OK,619_AL_TANQUE-D'ARCA_2024_T1.pdf
Taquarana,GERALDO CICERO DA SILVA,JOSE GILBERTO DA SILVA,MDB,15,6517,53.46,SEBASTIÃO ANTONIO DA SILVA,PP,5673.0,46.54,844.0,6.920000000000002,OK,619_AL_TAQUARANA_2024_T1.pdf
Teotônio Vilela,PEDRO HENRIQUE DE JESUS PEREIRA,ANDRE BORGES PEREIRA DA SILVA,PP,11,17729,77.19,VALDIR JOAQUIM DA SILVA NETO,MDB,5238.0,22.81,12491.0,54.379999999999995,OK,619_AL_TEOTÔNIO-VILELA_2024_T1.pdf
Traipu,MANUEL LUCAS KUMMER FREITAS DOS SANTOS,WAGNER DOS SANTOS CANUTO,MDB,15,12379,88.76,THIAGO JOSE SILVA CAVALCANTE,REPUBLICANOS,1568.0,11.24,10811.0,77.52000000000001,OK,619_AL_TRAIPU_2024_T1.pdf
União Dos Palmares,JOSÉ IRAN MENEZES DA SILVA JUNIOR,SAMIRES CANDIDO ULISSES,MDB,15,23163,63.83,BRUNNO LEONARDO VEIGA LOPES,PL,13127.0,36.17,10036.0,27.659999999999997,OK,619_AL_UNIÃO-DOS-PALMARES_2024_T1.pdf
Viçosa,JOÃO VICTOR CALHEIROS AMORIM SANTOS,AFRANIO TENORIO CAVALCANTE NETO,MDB,15,9301,57.45,FLAUBERT TORRES FILHO,PODE,6737.0,41.61,2564.0,15.840000000000003,OK,619_AL_VIÇOSA_2024_T1.pdf
Água Branca,NAYARA EMMANUELA BATISTA FEITOSA,JOSÉ HORLANDO DA SILVA SANTOS,PP,11,9227,78.03,RICARDO DE LIMA,PDT,2598.0,21.97,6629.0,56.06,OK,619_AL_ÁGUA-BRANCA_2024_T1.pdf
