municipio,local_sem_geo,registros_afetados,melhor_correspondencia_cache,score_similaridade,status_match
MACEIO,ESCOLA DE ENSINO FUNDAMENTAL DR JOSE HAROLDO DA COSTA,594,"MACEIO|ESCOLA DE ENSINO FUNDAMENTAL DR JOSE HAROLDO DA COSTA|CONJ. SALVADOR LIRA, S/N",0.7917,MATCH_FRACO
RIO LARGO,ESCOLA MUNICIPAL DR. GUSTAVO PAIVA,528,"RIO LARGO|ESCOLA MUNICIPAL DR. GUSTAVO PAIVA|CJ BARNABE OITICICA II, SN, MATA DO ROLO",0.6016,SEM_MATCH
PALMEIRA DOS INDIOS,COLÉGIO ESTADUAL HUMBERTO MENDES,486,PALMEIRA DOS INDIOS|COLEGIO ESTADUAL HUMBERTO MENDES|AV GOV MUNIZ FALCAO 701,0.5926,SEM_MATCH
MACEIO,ESCOLA DE ENS. FUND. NOSSO LAR I,467,"MACEIO|ESCOLA DE ENS. FUND. NOSSO LAR I|RUA SAMPAIO DORIA, S/N",0.6742,SEM_MATCH
PENEDO,COLÉGIO ESTADUAL COMENDADOR JOSÉ DA SILVA PEIXOTO,431,"PENEDO|COLEGIO ESTADUAL COMENDADOR JOSE DA SILVA PEIXOTO|RUA CASTRO ALVES, S/N, EM FRENTE A CODEVASF",0.6087,SEM_MATCH
MACEIO,ESCOLA ESTADUAL ROMEU DE AVELAR,428,"MACEIO|ESCOLA ESTADUAL ROMEU DE AVELAR|RUA RACOES CARB, S/N",0.6966,SEM_MATCH
UNIAO DOS PALMARES,ESCOLA ESTADUAL CARLOS GOMES DE BARROS,426,"UNIAO DOS PALMARES|ESCOLA ESTADUAL CARLOS GOMES DE BARROS|AV. JOAO LYRA FILHO, S/N",0.6441,SEM_MATCH
MACEIO,ESCOLA ESTADUAL AURELINA PALMEIRA DE MELO,422,"MACEIO|ESCOLA ESTADUAL AURELINA PALMEIRA DE MELO|PRACA PADRE CICERO, S/N",0.7321,SEM_MATCH
MACEIO,ESCOLA ESTADUAL PROFª. ROSALVA PEREIRA VIANA,410,"MACEIO|ESCOLA ESTADUAL PROFa. ROSALVA PEREIRA VIANA|LOT. POR DO SOL, QD D, S/N, MOCAMBO",0.6774,SEM_MATCH
ARAPIRACA,ESCOLA DE ENSINO FUNDAMENTAL CLAUDECY BISPO DOS SANTOS,399,ARAPIRACA|ESCOLA DE ENSINO FUNDAMENTAL CLAUDECY BISPO DOS SANTOS|RUA JOSE C. DE FARIAS,0.777,MATCH_FRACO
ARAPIRACA,ESCOLA DE 1 GRAU MANOEL ANDRÉ,395,ARAPIRACA|ESCOLA DE 1 GRAU MANOEL ANDRE|AV. JOSE LUCIO DA SILVA S/N,0.6105,SEM_MATCH
MACEIO,E.E. ALFREDO GASPAR DE MENDONCA,386,"MACEIO|E.E. ALFREDO GASPAR DE MENDONCA|CONJ. EUSTAQUIO GOMES DE MELO, S/N",0.6774,SEM_MATCH
MACEIO,E.E. GERALDO MELO DOS SANTOS,385,"MACEIO|E.E. GERALDO MELO DOS SANTOS|RUA 61, QD C-6, CJ. GRACILIANO RAMOS",0.6555,SEM_MATCH
MACEIO,ESC. EST. MIRAN MARROQUIM,381,"MACEIO|ESC. EST. MIRAN MARROQUIM|RUA DA LIBERDADE, S/N - PIABAS",0.5977,SEM_MATCH
RIO LARGO,COMPLEXO ESTADUAL PROFA CLAUDIZETE LIMA ELEUTERIO,370,"RIO LARGO|COMPLEXO ESTADUAL PROFA CLAUDIZETE LIMA ELEUTERIO|CONJ GURIATA, S/N",0.784,MATCH_FRACO
ARAPIRACA,GRUPO ESCOLAR JOÃO BATISTA PEREIRA,362,ARAPIRACA|GRUPO ESCOLAR JOAO BATISTA PEREIRA|COHAB NOVA S/N,0.7312,SEM_MATCH
ARAPIRACA,ESCOLA DE ENSINO FUNDAMENTAL MANOEL HUMBERTO DA COSTA,360,ARAPIRACA|ESCOLA DE ENSINO FUNDAMENTAL MANOEL HUMBERTO DA COSTA|SITIO BATINGAS,0.8092,MATCH_FRACO
MACEIO,E.M. JAYME DE ALTAVILLA,359,"MACEIO|E.M. JAYME DE ALTAVILLA|RUA DILERMANO REIS, S/N, LOT SANTA LUCIA",0.6034,SEM_MATCH
ARAPIRACA,ESCOLA DE 1 GRAU PARQUE LIONS,357,ARAPIRACA|ESCOLA DE 1 GRAU PARQUE LIONS|RUA GOV. AFRANIO LAGES S/N,0.617,SEM_MATCH
MACEIO,ESCOLA ESTADUAL PROFª. MARIA SALETE GUSMAO DE ARAUJO,353,"MACEIO|ESCOLA ESTADUAL PROFa. MARIA SALETE GUSMAO DE ARAUJO|CJ. OSMAN LOUREIRO, QD A",0.7634,MATCH_FRACO
ARAPIRACA,ESCOLA JOÃO SATURNINO DE ALMEIDA,342,ARAPIRACA|ESCOLA JOAO SATURNINO DE ALMEIDA|AV. JOAO SATURNINO S/N,0.6667,SEM_MATCH
ARAPIRACA,ESCOLA DE 1 GRAU FERNANDO COLLOR DE MELLO,329,ARAPIRACA|ESCOLA DE 1 GRAU FERNANDO COLLOR DE MELLO|POVOADO CANAA S/N,0.7455,SEM_MATCH
MACEIO,E.M. PROFESSOR CORINTHO DA PAZ,328,"MACEIO|E.M. PROFESSOR CORINTHO DA PAZ|RUA 5-A, S/N - CJ. EUSTAQUIO GOMES DE MELO",0.6462,SEM_MATCH
ARAPIRACA,ESCOLA DE ENSINO FUNDAMENTAL ENÉAS BENEDITO DOS SANTOS,323,ARAPIRACA|ESCOLA DE ENSINO FUNDAMENTAL ENEAS BENEDITO DOS SANTOS|POVOADO CANGANDU S/N,0.777,MATCH_FRACO
MACEIO,ESC. EST. PROF. THEOTÔNIO VILELA BRANDÃO,319,"MACEIO|ESC. EST. PROF. THEOTONIO VILELA BRANDAO|RUA ADAUTO GOMES BARBOSA, SN - SANTO EDUARDO",0.6475,SEM_MATCH
ARAPIRACA,ESCOLA DE ENSINO FUNDAMENTAL ZÉLIA BARBOSA ROCHA,314,ARAPIRACA|ESCOLA DE ENSINO FUNDAMENTAL ZELIA BARBOSA ROCHA|RUA DJALMA M. SANTANA,0.7559,MATCH_FRACO
SAO MIGUEL DOS CAMPOS,COLEGIO MUNICIPAL LUZINETE E LINDALVA JATOBA,313,"SAO MIGUEL DOS CAMPOS|COLEGIO MUNICIPAL LUZINETE E LINDALVA JATOBA|AV. SAMPAIO MARQUES, S/N",0.6617,SEM_MATCH
MACEIO,COLÉGIO INTENSIVO,308,"MACEIO|COLEGIO INTENSIVO|LARGO DA VITORIA, 215",0.5484,SEM_MATCH
MACEIO,ESCOLA ESTADUAL PROFª. IRENE GARRIDO,308,"MACEIO|ESCOLA ESTADUAL PROFa. IRENE GARRIDO|RUA G, QD 3, S/N, CONJ. DUBEAUX LEAO",0.6239,SEM_MATCH
MACEIO,COLÉGIO EDSON MONTEIRO,308,"MACEIO|SUMESE|AV DURVAL DE GOES MONTEIRO, S/N",0.5152,SEM_MATCH
RIO LARGO,ESCOLA ESTADUAL SANTOS DUMONT,301,"MACEIO|ESCOLA ESTADUAL TAVARES BASTOS|PRACA CENTENARIO, S/N",0.5517,SEM_MATCH
ARAPIRACA,ESCOLA DE ENSINO FUNDAMENTAL CLEONICE BARBOSA DE ALMEIDA,301,ARAPIRACA|ESCOLA DE ENSINO FUNDAMENTAL ZELIA BARBOSA ROCHA|RUA DJALMA M. SANTANA,0.6667,SEM_MATCH
MACEIO,ESCOLA EST. DR. EDSON BERNARDES,300,"MACEIO|ESCOLA EST. DR. EDSON BERNARDES|CONJ. JOAQUIM LEAO, S/N",0.6947,SEM_MATCH
MACEIO,COLÉGIO ZUMBI DOS PALMARES,299,"MACEIO|COLEGIO ZUMBI DOS PALMARES|CJ ROSANE COLLOR, QD M, S/N",0.6118,SEM_MATCH
MACEIO,ESC. MUN. PROF. LENILTO ALVES SANTOS,289,"MACEIO|ESC. MUN. PROF. LENILTO ALVES SANTOS|RUA ENFERMEIRO MARIANO - COHAB, S/N",0.6721,SEM_MATCH
MACEIO,E.E. DEPUTADO RUBENS CANUTO,287,"MACEIO|E.E. DEPUTADO RUBENS CANUTO|AV. GURGURI , S/N",0.7755,MATCH_FRACO
RIO LARGO,ESCOLA DE ENSINO FUND DR GASTAO OITICICA,282,RIO LARGO|ESCOLA DE ENSINO FUND DR GASTAO OITICICA|AV JULIO CALHEIROS S/N,0.7273,SEM_MATCH
ARAPIRACA,ESCOLA DE ENSINO FUNDAMENTAL LOJA MAÇONICA,281,"MACEIO|ESCOLA DE ENSINO FUNDAMENTAL PEDRO SURUAGY|AV. MACEIO, S/N",0.7048,SEM_MATCH
ARAPIRACA,GRUPO ESCOLAR PEDRO CORREIA DAS GRAÇAS,279,ARAPIRACA|GRUPO ESCOLAR PEDRO CORREIA DAS GRACAS|RUA VICENTE NUNES S/N,0.7037,SEM_MATCH
MACEIO,ESC. MUN. ARNON AFFONSO FARIAS DE MELLO,275,"MACEIO|ESC. MUN. ARNON AFFONSO FARIAS DE MELLO|CONJ. JOSE DA SILVA PEIXOTO, S/N",0.678,SEM_MATCH
MACEIO,COLÉGIO MARIA MONTESSORI,274,MACEIO|COLEGIO MARIA MONTESSORI|RUA PAPA JOAO PAULO 30,0.6154,SEM_MATCH
CORURIPE,ESCOLA ESTADUAL LIMA CASTRO,273,"MACEIO|E.E. ONELIA CAMPELO|RUA SANTA TEREZINHA, S/N",0.5682,SEM_MATCH
MACEIO,COLÉGIO SANTÍSSIMO SENHOR,271,MACEIO|COLEGIO SANTA URSULA|RUA PIO XII,0.4688,SEM_MATCH
MACEIO,ESC. EST. PROF. EDUARDO DA MOTA TRIGUEIROS,270,"MACEIO|ESC. EST. PROF. EDUARDO ALMEIDA DA SILVA|RUA SAO PEDRO, S/N",0.6838,SEM_MATCH
UNIAO DOS PALMARES,ESCOLA MUNICIPAL JOÃO COSTA DE OLIVEIRA,267,"UNIAO DOS PALMARES|ESCOLA MUNICIPAL JOAO COSTA DE OLIVEIRA|QUADRA P1, S/N",0.7027,SEM_MATCH
ARAPIRACA,ESCOLA PROFESSOR LUIZ ALBERTO DE MELO,264,ARAPIRACA|ESCOLA PROFESSOR LUIZ ALBERTO DE MELO|POVOADO PAU D ARCO S/N,0.6916,SEM_MATCH
ARAPIRACA,GRUPO ESCOLAR DOMINGOS LOPES,260,ARAPIRACA|GRUPO ESCOLAR DOMINGOS LOPES|RUA VEREADOR DOMINGOS LOPES S/N,0.5714,SEM_MATCH
MACEIO,ESC. MUN. PROFª EULINA RIBEIRO ALENCAR,259,"MACEIO|ESC. MUN. PROFa EULINA RIBEIRO ALENCAR|RUA COARACI FONSECA, 01",0.7103,SEM_MATCH
MACEIO,ESCOLA ESTADUAL PROFESSOR PEDRO TEIXEIRA,259,"MACEIO|ESCOLA ESTADUAL PROFESSOR PEDRO TEIXEIRA|RUA PAU DARCO, S/N",0.7619,MATCH_FRACO
MACEIO,E.E. JORNALISTA LAFAIETTE BELO,259,"MACEIO|E.E. JORNALISTA LAFAIETTE BELO|PARQUE RESIDENCIAL BENEDITO BENTES I, S/N",0.6308,SEM_MATCH
ARAPIRACA,GRUPO ESCOLAR JOSE PEREIRA LÚCIO,252,ARAPIRACA|GRUPO ESCOLAR JOSE PEREIRA LUCIO|POVOADO BANANEIRAS S/N,0.6598,SEM_MATCH
MACEIO,ESCOLA MONTEIRO LOBATO,250,"MACEIO|ESCOLA MONTEIRO LOBATO|RUA DO IPE ROXO, 291",0.6197,SEM_MATCH
MACEIO,ESCOLA DE ENSINO FUNDAMENTAL PROF. DONIZETTI CALHEIROS,249,"MACEIO|ESCOLA DE ENSINO FUNDAMENTAL PROF. DONIZETTI CALHEIROS|AV. UBERABA, S/N",0.8406,MATCH_FRACO
CORURIPE,ESCOLA ESTADUAL DJALMA BARROS SIQUEIRA,249,"CORURIPE|ESCOLA ESTADUAL DJALMA BARROS SIQUEIRA|RUA PERNAMBUCO NOVO, S/N",0.6972,SEM_MATCH
MACEIO,ESC. MUN. ANTÔNIO SEMEÃO LAMENHA LINS,247,"MACEIO|ESC. MUN. ANTONIO SEMEAO LAMENHA LINS|RUA MAJOR JOAQUIM CALHEIROS, S/N",0.6609,SEM_MATCH
MACEIO,E.M. PROF. AURÉLIO BUARQUE DE HOLANDA FERREIRA,246,"MACEIO|E.M. PROF. AURELIO BUARQUE DE HOLANDA FERREIRA|RUA F, S/N, CONJUNTO FREITAS NETO",0.7607,MATCH_FRACO
MACEIO,ESC. EST. MANOEL SIMPLICIO DO NASCIMENTO,244,"MACEIO|ESC. EST. MANOEL SIMPLICIO DO NASCIMENTO|RUA DIVISORIA FEICAO, S/N",0.7193,SEM_MATCH
RIO LARGO,ESCOLA DE EDUCAÇÃO BÁSICA AGNUS DEI,243,"MACEIO|ESCOLA DE EDUCACAO BASICA JOSE GONZAGA|RUA 7 DE SETEMBRO, N 344",0.6154,SEM_MATCH
MACEIO,E.M. MARIA CARMELITA CARDOSO GAMA (CAIC-UFAL),241,"MACEIO|E.M. MARIA CARMELITA CARDOSO GAMA (CAIC-UFAL)|BR 104, 1099 KM 14 - CAMPUS A.C.SIMOES",0.719,SEM_MATCH
RIO LARGO,ESCOLA MUNICIPAL TERESA CRISTINA LINS DE SOUZA COSTA,240,"RIO LARGO|ESCOLA MUNICIPAL TERESA CRISTINA LINS DE SOUZA COSTA|CJ RES. FRANCISCO TAVARES GRANJA, S/N",0.6933,SEM_MATCH
MACEIO,ESC. MUN. DR. BALTAZAR DE MENDONÇA,239,"MACEIO|ESC. MUN. DR. BALTAZAR DE MENDONCA|RUA DIVISORIA FEICAO, S/N",0.7037,SEM_MATCH
PENEDO,COLÉGIO DIOCESANO DE PENEDO,238,"MACEIO|COLEGIO DLINS|RUA PEDROSA, 225",0.5397,SEM_MATCH
RIO LARGO,ESCOLA MUNICIPAL DE EDUCAÇÃO BASICA INDUSTRIAL LUIGI BAUDUCCO,236,RIO LARGO|ESCOLA MUNICIPAL DE EDUCACAO BASICA D PEDRO I|RUA CURITIBA S/N,0.6466,SEM_MATCH
PENEDO,ESCOLA MUNICIPAL VEREADOR MANOEL SOARES DE MELO,236,"PENEDO|ESCOLA MUNICIPAL VEREADOR MANOEL SOARES DE MELO|RUA FLORIANO ROSA, S/N, PX. AO POSTO DE SAUDE, CONJUNTO VILA MATIAS",0.5697,SEM_MATCH
PALMEIRA DOS INDIOS,FACULDADE CESMAC DO SERTÃO,234,"PALMEIRA DOS INDIOS|FACULDADE CESMAC DO SERTAO|RUA BRAULIO MONTENEGRO, S/N, VILA MARIA",0.4727,SEM_MATCH
MACEIO,E.E. PROFA. GILVANA ATAÍDE CAVALCANTE CABRAL,234,"MACEIO|E.E. PROFA. GILVANA ATAIDE CAVALCANTE CABRAL|RUA ELINELMA DE OLIVEIRA SANTOS, S/N",0.7152,SEM_MATCH
SAO MIGUEL DOS CAMPOS,ESCOLA MUNICIPAL PROFESSORA INEIDE NOGUEIRA ROCHA,231,"MACEIO|ESCOLA MUNICIPAL TEREZA DE JESUS|RUA SARGENTO JAIME, 75",0.5636,SEM_MATCH
RIO LARGO,ESCOLA DE ENSINO FUNDAMENTAL MARIETA LEÃO,229,RIO LARGO|ESCOLA DE ENSINO FUNDAMENTAL MARIETA LEAO|PATIO DA REDE FERROVIARIA S/N,0.6721,SEM_MATCH
PENEDO,ESCOLA ESTADUAL PROFESSOR ERNANI MÉRO (GRUPO ESCOLAR EXPERIMENTAL),227,"PENEDO|ESCOLA ESTADUAL PROFESSOR ERNANI MERO (GRUPO ESCOLAR EXPERIMENTAL)|PRACA LARGO DE FATIMA, S/N, EM FRENTE AO NUDEPE",0.6564,SEM_MATCH
MACEIO,ESC. MUN. DR. ORLANDO ARAÚJO,226,"MACEIO|ESC. MUN. DR. ORLANDO ARAUJO|RUA DR. JOSE SAMPAIO LUZ, S/N",0.6214,SEM_MATCH
SAO MIGUEL DOS CAMPOS,ESCOLA MUNICIPAL MARIO SOARES PALMEIRA,225,"SAO MIGUEL DOS CAMPOS|ESCOLA MUNICIPAL MARIO SOARES PALMEIRA|RUA VISCONDE DE SINIMBU, 32",0.608,SEM_MATCH
RIO LARGO,ESCOLA DE ENSINO FUND PROF ROSINEIDE TEREZA MARTINS DA CONCEIÇÃO,223,RIO LARGO|ESCOLA DE ENSINO FUND PROF ROSINEIDE TEREZA MARTINS DA CONCEICAO|EUCLIDES AFONSO DE MELO S/N,0.7841,MATCH_FRACO
RIO LARGO,GRUPO ESCOLAR MANOEL SOARES DE SOUZA,218,RIO LARGO|GRUPO ESCOLAR MANOEL SOARES DE SOUZA|VILA RAUL S/N,0.75,MATCH_FRACO
MACEIO,ESC. MUN. RADIALISTA EDÉCIO LOPES (ANTIGO COL. LAERSON ROSA),212,"MACEIO|ESC. MUN. RADIALISTA EDECIO LOPES (ANTIGO COL. LAERSON ROSA)|RUA ALAMEDA CELIA DOS ANJOS, 06",0.7654,MATCH_FRACO
MACEIO,CENTRO DE ENSINO SANTA JULIANA,212,"MACEIO|CENTRO DE ENSINO SANTA JULIANA|AV DURVAL DE GOES MONTEIRO, 2345, C67P, CM",0.5607,SEM_MATCH
ARAPIRACA,GRUPO ESCOLAR ANTÔNIO CEZÁRIO DE OLIVEIRA,212,ARAPIRACA|GRUPO ESCOLAR ANTONIO CEZARIO DE OLIVEIRA|VILA SAO JOSE S/N,0.7455,SEM_MATCH
RIO LARGO,ESCOLA MUNICIPAL DE ENSINO F. PROFESSOR JOSÉ EDMILSON,211,"RIO LARGO|ESCOLA MUNICIPAL DE ENSINO F. PROFESSOR JOSE EDMILSON|COJ NAPOLEAO VIANA,S/N, BAR NOSSO, PREF ANTONIO LINS DE SOUZA",0.5977,SEM_MATCH
MACEIO,E.M. TRADUTOR JOÃO SAMPAIO,209,"MACEIO|E.M. TRADUTOR JOAO SAMPAIO|PRACA CENTRAL, S/N, CONJ. JOAO SAMPAIO I",0.6281,SEM_MATCH
MACEIO,ESCOLA MUN. SÉRGIO LUIZ PESSOA BRAGA,205,"MACEIO|ESCOLA MUN. SERGIO LUIZ PESSOA BRAGA|PRACA GOVERNADOR LAMENHA FILHO, S/N",0.625,SEM_MATCH
MACEIO,COLÉGIO SAGRADA FAMILIA,203,PALMEIRA DOS INDIOS|COLEGIO SAGRADA FAMILIA|RUA DOM BOSCO 15,0.5542,SEM_MATCH
ARAPIRACA,ANEXO ESCOLA JAYME DE ALTAVILLA,203,ARAPIRACA|ANEXO ESCOLA JAYME DE ALTAVILLA|AV. MIGUEL CORREIA S/N,0.6596,SEM_MATCH
CORURIPE,ESCOLA MUN. EDUC. BÁSICA PROF. MARIA ROCHA SANTOS SILVA,198,"CORURIPE|ESCOLA MUN. EDUC. BASICA PROF. MARIA ROCHA SANTOS SILVA|TRAVESSA FLAMENGO, 182, QUADRA S",0.7403,SEM_MATCH
ARAPIRACA,ESCOLA LINDAUVA EULÁLIA DE FARIAS,197,ARAPIRACA|ESCOLA LINDAUVA EULALIA DE FARIAS|POVOADO BAIXA GRANDE DE DENTRO,0.6168,SEM_MATCH
ARAPIRACA,ESCOLA DE ENSINO FUNDAMENTAL VOLUNTÁRIA MARIA DAS NEVES BORGES,196,"ARAPIRACA|ESCOLA DE ENSINO FUNDAMENTAL VOLUNTARIA MARIA DAS NEVES BORGES|RUA SINESIO FERREIRA LIMA, N 383, OURO PRETO",0.7006,SEM_MATCH
MACEIO,ESC. DE ENS. FUND. PROF. ALMEIDA LEITE,194,"MACEIO|ESC. DE ENS. FUND. PROF. ALMEIDA LEITE|RUA DR. VIRGILIO GUEDES, S/N",0.6885,SEM_MATCH
MACEIO,ESCOLA MUNICIPAL PROFESSORA JAREDE VIANA DE OLIVEIRA,194,"MACEIO|E.M. PROFESSOR PETRONIO VIANA|CONJUNTO CARMINHA, S/N",0.623,SEM_MATCH
MACEIO,SEST/SENAT,193,"MACEIO|SEST/SENAT|AV. DEP. CESAR ESUSTAQUIO MALTA, 500",0.3279,SEM_MATCH
MACEIO,COLÉGIO SANTA AMÉLIA,193,MACEIO|COLEGIO SANTA URSULA|RUA PIO XII,0.5424,SEM_MATCH
MACEIO,ESCOLA DE ENSINO FUNDAMENTAL CLETO MARQUES LUZ,190,"MACEIO|ESCOLA DE ENSINO FUNDAMENTAL CLETO MARQUES LUZ|RUA P, LOT COLINA DOS EUCALIPTOS",0.7023,SEM_MATCH
MACEIO,E.M. PROFA. HÉVIA VALÉRIA MAIA AMORIM,189,"MACEIO|E.M. PROFA. HEVIA VALERIA MAIA AMORIM|AV JOSE AILTON DOS SANTOS, S/N, VILAGE CAMPESTRE I",0.6316,SEM_MATCH
MACEIO,E.M. MARIA DE LOURDES DE MELO PIMENTEL,189,"MACEIO|E.M. MARIA DE LOURDES DE MELO PIMENTEL|RUA PADRE CICERO, 05, VILAGE CAMPESTE II",0.6849,SEM_MATCH
CORURIPE,ESCOLA MUN. CENT. EDUCAÇÃO INFANTIL PROF. MARIA ZENAIDE ROCHA SANTOS,188,"CORURIPE|ESCOLA MUN. CENT. EDUCACAO INFANTIL PROF. MARIA ZENAIDE ROCHA SANTOS|RUA PERNAMBUCO NOVO, S/N,",0.8092,MATCH_FRACO
MACEIO,ESC. MUN. JOÃO XXIII,188,"MACEIO|ESC. MUN. JOAO XXIII|RUA DR.JOSE JOAQUIM DE ARAUJO, S/N",0.4884,SEM_MATCH
CORURIPE,ESCOLA MUNICIPAL SANTA SOFIA,188,"MACEIO|ESCOLA MUNICIPAL TOBIAS GRANJA|RUA SAO JOSE, 888",0.5854,SEM_MATCH
RIO LARGO,ANTIGA ESCOLA FRANCISCO LEÃO DO CENTRO,187,"RIO LARGO|ANTIGA ESCOLA FRANCISCO LEAO DO CENTRO|PRACA TEIZEIRA BARROS., SN",0.6847,SEM_MATCH
MACEIO,ESCOLA MUN. SILVESTRE PÉRICLES,184,MACEIO|ESCOLA MUN. SILVESTRE PERICLES|PRACA DR CAIO DE AGUIAR PORTO S/N - PONTAL DA BARRA,0.4874,SEM_MATCH
DELMIRO GOUVEIA,"VIRGILIA BEZERRA,ESCOLA DE 1 E 2 GRAUS PROFESSORA",177,"DELMIRO GOUVEIA|VIRGILIA BEZERRA,ESCOLA DE 1 E 2 GRAUS PROFESSORA|AV MASCARENHAS DE MORAIS S/N",0.6853,SEM_MATCH
PENEDO,COOPERATIVA EDUCACIONAL DE PENEDO - COOPEPE LTDA,175,"PENEDO|COOPERATIVA EDUCACIONAL DE PENEDO - COOPEPE LTDA|PARQUE DR. ADAIL FREIRE PEREIRA, 127 (PRACA SANTA LUZIA)",0.5897,SEM_MATCH
MACEIO,COLEGIO ATHENEU,172,"MACEIO|COLEGIO ATHENEU|ESTRADA DA CODEAL, 33",0.5172,SEM_MATCH
ARAPIRACA,ESCOLAR ANA BERNARDES SILVEIRA,171,ARAPIRACA|ESCOLAR ANA BERNARDES SILVEIRA|SERRA DOS FERREIRA S/N,0.6452,SEM_MATCH
CORURIPE,ESCOLA ESTADUAL DEPUTADO JOÃO BELTRÃO,171,"CORURIPE|ESCOLA ESTADUAL DEPUTADO JOAO BELTRAO|AV. ANFRISIO DE CASTRO LESSA SANTOS, 506",0.6066,SEM_MATCH
MACEIO,ESCOLA ESTADUAL TAVARES BASTOS,169,"MACEIO|ESCOLA ESTADUAL TAVARES BASTOS|PRACA CENTENARIO, S/N",0.6818,SEM_MATCH
MACEIO,ESCOLA ESTADUAL DR. JÚLIO AUTO,168,"MACEIO|ESCOLA ESTADUAL DR. JULIO AUTO|CONJUNTO JOAQUIM LEAO, S/N",0.6667,SEM_MATCH
MARECHAL DEODORO,ESCOLA MUNICIPAL ALTINA RIBEIRO TOLEDO,168,MARECHAL DEODORO|ESCOLA MUNICIPAL ALTINA RIBEIRO TOLEDO|VILA ALTINA SN,0.7037,SEM_MATCH
RIO LARGO,ESCOLA PREFEITO WALTER DORIA DE FIGUEIREDO,166,"RIO LARGO|ESCOLA PREFEITO WALTER DORIA DE FIGUEIREDO|CJ MARIO MAFRA, QUADRA D-04",0.6942,SEM_MATCH
MARECHAL DEODORO,ESCOLA ESTADUAL JOSÉ CORREIA DA SILVA TITARA,165,MARECHAL DEODORO|ESCOLA ESTADUAL JOSE CORREIA DA SILVA TITARA|LOT BOSQUE DA MASSAGUEIRA N 3A,0.6471,SEM_MATCH
MACEIO,E.E. MANUEL BALTAZAR P. DIEGUES JUNIOR,164,"MACEIO|E.E. MANUEL BALTAZAR P. DIEGUES JUNIOR|CONJUNTO SANTA MARIA, S/N - RUA D QD 8",0.6906,SEM_MATCH
RIO LARGO,ESCOLA ESTADUAL TABULEIRO DO PINTO,162,RIO LARGO|ESCOLA ESTADUAL TABULEIRO DO PINTO|RUA DA CAIXA SN,0.7234,SEM_MATCH
RIO LARGO,CRECHE MUNICIPAL CELYRIO ADAMASTOR BARRETO ACIOLY,161,"RIO LARGO|CRECHE MUNICIPAL CELYRIO ADAMASTOR BARRETO ACIOLY|ROD AL 210, CJ EDSON NOVAES S/N",0.705,SEM_MATCH
MACEIO,COLÉGIO BRASIL (ANTIGO ISAAC NEWTON),159,"MACEIO|COLEGIO BRASIL (ANTIGO ISAAC NEWTON)|RUA FERNANDO MENDES PINTO, N 11",0.6415,SEM_MATCH
MACEIO,E.M. GASTONE LÚCIA DE CARVALHO BELTRÃO,159,"MACEIO|E.M. GASTONE LUCIA DE CARVALHO BELTRAO|CONJ. JARDIM ROYAL - MODULO II - QD Q, S/N",0.6944,SEM_MATCH
MACEIO,EDIFÍCIO DO SENAC,158,"MACEIO|EDIFICIO DO SENAC|AV. PEDRO PAULINO, 77",0.5574,SEM_MATCH
SAO MIGUEL DOS CAMPOS,ESCOLA MUNICIPAL DIONISIA APRATTO TENORIO,156,"SAO MIGUEL DOS CAMPOS|ESCOLA MUNICIPAL DIONISIA APRATTO TENORIO|AV. PREFEITO PEDRO FERNANDES, S/N",0.6029,SEM_MATCH
RIO LARGO,GRUPO ESCOLAR DALMARIO DE SOUZA,156,RIO LARGO|GRUPO ESCOLAR DALMARIO DE SOUZA|RUA ALTO DA SAUDADE SN,0.6526,SEM_MATCH
SAO MIGUEL DOS CAMPOS,ESCOLA DE EDUCAÇÃO BÁSICA CONSTRUTIVISTA,155,"SAO MIGUEL DOS CAMPOS|ESCOLA DE EDUCACAO BASICA CONSTRUTIVISTA|RUA PROJETADA, 16",0.6723,SEM_MATCH
ARAPIRACA,CENTRO DE EDUCAÇÃO INFANTIL JOANNA DE ANGELLIS (ANTIGO MADRE PAULINA),154,ARAPIRACA|CENTRO DE EDUCACAO INFANTIL JOANNA DE ANGELLIS (ANTIGO MADRE PAULINA)|RUA DOMINGOS CORREIA 1065,0.7882,MATCH_FRACO
MARECHAL DEODORO,ESCOLA MUNICIPAL PREFEITO MANOEL MESSIAS DOS SANTOS,153,MARECHAL DEODORO|ESCOLA MUNICIPAL PREFEITO MANOEL MESSIAS DOS SANTOS|RUA SALVADOR S/N LOT. LUAR DO FRANCES,0.6538,SEM_MATCH
MACEIO,E.E. MANOEL DE ARAUJO DORIA,152,"MACEIO|ESCOLA ESTADUAL ROMEU DE AVELAR|RUA RACOES CARB, S/N",0.5833,SEM_MATCH
MACEIO,E.M. SELMA BANDEIRA,151,"MACEIO|E.M. FREI DAMIAO|AV. MUNDAU, 120",0.625,SEM_MATCH
MACEIO,ESC. MUN. PIO X (PRÉDIO DO ANTIGO COL.SAGRADA FAMÍLIA),150,"MACEIO|ESC. MUN. PIO X (PREDIO DO ANTIGO COL.SAGRADA FAMILIA)|RUA PROFESSORA ZEZE LOUREIRO, 200",0.7368,SEM_MATCH
MARECHAL DEODORO,ESCOLA MUNICIPAL MARIA PETRONILA DE GOUVEA,149,MARECHAL DEODORO|ESCOLA MUNICIPAL MARIA PETRONILA DE GOUVEA|RUA MARINITA DE GOUVEIA SN,0.6562,SEM_MATCH
MACEIO,ESCOLA SANTA ROSA,148,MACEIO|ESCOLA HIGINO BELO|AV SANTA RITA DE CASSIA,0.4848,SEM_MATCH
RIO LARGO,GRUPO ESCOLAR OZORIA MOURA DE LIMA,147,RIO LARGO|GRUPO ESCOLAR OZORIA MOURA DE LIMA|RUA ANTONIO ELIAS CALHEIROS S/N,0.6182,SEM_MATCH
MARECHAL DEODORO,ESCOLA ESTADUAL DEODORO DA FONSECA,147,MARECHAL DEODORO|ESCOLA ESTADUAL DEODORO DA FONSECA|PRACA PEDRO PAULINO SN,0.6296,SEM_MATCH
SAO MIGUEL DOS CAMPOS,CRECHE JOSEFA BENEDITA DOS SANTOS,141,SAO MIGUEL DOS CAMPOS|CRECHE JOSEFA BENEDITA DOS SANTOS|AVENIDA PEDRO FERNANDES DE COSTA,0.5455,SEM_MATCH
RIO LARGO,ESCOLA ESTADUAL JOÃO MORAIS CAVALCANTE,141,"MACEIO|ESCOLA ESTADUAL JOAO PAULO II|RUA MANOEL INACIO, S/N",0.5833,SEM_MATCH
MACEIO,CLUBE DA CAIXA ECONÔMICA FEDERAL (APCEF/AL),141,"MACEIO|CLUBE DA CAIXA ECONOMICA FEDERAL (APCEF/AL)|ROD. AL 101 NORTE, S/N",0.7455,SEM_MATCH
SAO MIGUEL DOS CAMPOS,COLÉGIO MUNICIPAL ESTHER SOARES TORRES,139,"SAO MIGUEL DOS CAMPOS|COLEGIO MUNICIPAL ESTHER SOARES TORRES|AVENIDA PREFEITO PEDRO FERNANDES DA COSTA, S/N",0.5278,SEM_MATCH
SAO MIGUEL DOS CAMPOS,ESCOLA DE ENSINO SUPERIOR DE SAO MIGUEL DOS CAMPOS,135,"SAO MIGUEL DOS CAMPOS|ESCOLA DE ENSINO SUPERIOR DE SAO MIGUEL DOS CAMPOS|PRACA SENHORA DOS PRAZERES, SN",0.6579,SEM_MATCH
RIO LARGO,GRUPO ESCOLAR PROFESSOR POMPEU SARMENTO,132,RIO LARGO|GRUPO ESCOLAR PROFESSOR POMPEU SARMENTO|TRAV SANTA LUZIA S/N,0.7156,SEM_MATCH
CORURIPE,CENTRO EDUCACIONAL PROFISSIONAL MARIA ALICE BELTRÃO DE CASTRO SIQUEIRA,131,CORURIPE|CENTRO EDUCACIONAL PROFISSIONAL MARIA ALICE BELTRAO DE CASTRO SIQUEIRA|RUA PERNAMBUCO NOVO,0.8284,MATCH_FRACO
MACEIO,ESCOLA MUN. DOM MIGUEL FENELON CÂMARA,130,"MACEIO|ESCOLA MUN. DOM MIGUEL FENELON CAMARA|LOTEAMENTO JARDIM PETROPOLIS II, SN, QD 26",0.6,SEM_MATCH
MACEIO,ESCOLA MUN. PROF. DERALDO CAMPOS,129,"MACEIO|ESCOLA MUN. PROF. DERALDO CAMPOS|RUA TENENTE MOISES S. FIRMINO, S/N",0.6364,SEM_MATCH
CORURIPE,ESCOLA MUNICIPAL MANOEL CECÍLIO DE JESUS,128,"CORURIPE|ESCOLA MUNICIPAL MANOEL CECILIO DE JESUS|RUA DO JASMIM,",0.7767,MATCH_FRACO
ARAPIRACA,GRUPO ESCOLAR CÔNEGO EPITÁCIO RODRIGUES,127,ARAPIRACA|GRUPO ESCOLAR CONEGO EPITACIO RODRIGUES|VILA SAO FRANCISCO,0.729,SEM_MATCH
MARECHAL DEODORO,ESCOLA MUNICIPAL CARLOS AVELINO DA SILVA,126,"MARECHAL DEODORO|ESCOLA MUNICIPAL CARLOS AVELINO DA SILVA|RES MARIA GISLENE MATHEUS, S/N",0.6299,SEM_MATCH
RIO LARGO,ESCOLA DE EDUCAÇÃO INFANTIL PADRE PAULINO,125,RIO LARGO|ESCOLA DE EDUCACAO INFANTIL PADRE PAULINO|CONJUNTO MUTIRAO,0.7523,MATCH_FRACO
MACEIO,INSS,125,"MACEIO|COLEGIO DLINS|RUA PEDROSA, 225",0.2,SEM_MATCH
ARAPIRACA,IFAL - INSTITUTO FEDERAL DE ALAGOAS,125,"ARAPIRACA|IFAL - INSTITUTO FEDERAL DE ALAGOAS|RODOVIA AL 110, N 4805",0.6735,SEM_MATCH
MACEIO,ESC. EST. PROFª ANA COELHO PALMEIRA,124,"MACEIO|ESC. EST. PROFa ANA COELHO PALMEIRA|CONJ. ALFREDO GASPAR DE MENDONCA, S/N",0.614,SEM_MATCH
PENEDO,ESCOLA ESTADUAL DR. ALCIDES ANDRADE,122,"MACEIO|E.E. OTACILIO HOLANDA DE ANDRADE|RUA SAO LUIZ, 09",0.5962,SEM_MATCH
PENEDO,EMEB VEREADOR JOSÉ DA COSTA MANGABEIRA,122,"PENEDO|EMEB VEREADOR JOSE DA COSTA MANGABEIRA|RUA F, LOTEAMENTO SAO GONCALO, SN",0.6609,SEM_MATCH
RIO LARGO,GRUPO ESCOLAR ODILO ALVARES DE SOUZA,122,RIO LARGO|GRUPO ESCOLAR ODILO ALVARES DE SOUZA|AV MUNIZ FALCAO SN,0.7129,SEM_MATCH
RIO LARGO,ESCOLA DE EDUCAÇÃO INFANTIL AQUINO JAPIASSÚ,120,RIO LARGO|ESCOLA DE EDUCACAO INFANTIL AQUINO JAPIASSU|VILA MARILIA,0.789,MATCH_FRACO
MACEIO,CMEI HERBERT DE SOUZA,115,"MACEIO|CMEI HERBERT DE SOUZA|ROD. AL 101 NORTE, S/N",0.6,SEM_MATCH
ARAPIRACA,CENTRO DE EDUCAÇÃO INFANTIL MARIA DE LOURDES PEREIRA CAVALCANTE,115,"ARAPIRACA|CENTRO DE EDUCACAO INFANTIL MARIA DE LOURDES PEREIRA CAVALCANTE|RUA OSMAN CAVALCANTE, S/N",0.7826,MATCH_FRACO
SAO MIGUEL DOS CAMPOS,ESCOLA DE 1 E 2 GRAUS NUNILA MACHADO,115,"SAO MIGUEL DOS CAMPOS|ESCOLA DE 1 E 2 GRAUS NUNILA MACHADO|VISCONDE DE SINIMBU, 182",0.6102,SEM_MATCH
DELMIRO GOUVEIA,"FRANCISCA ROSA DA COSTA,GRUPO ESCOLAR",113,"DELMIRO GOUVEIA|FRANCISCA ROSA DA COSTA,GRUPO ESCOLAR|RUA SARGENTO REGINALDO BANDEIRA, 342",0.5873,SEM_MATCH
MACEIO,E.E. AQUILINA BULHÕES BARROS,111,"MACEIO|E.E. AQUILINA BULHOES BARROS|RUA HENRIQUE FRANCISCO BULHOES, 14 QD C",0.629,SEM_MATCH
SAO MIGUEL DOS CAMPOS,ESCOLA DE 1 GRAU TARCISIO SOARES PALMEIRA,110,"SAO MIGUEL DOS CAMPOS|ESCOLA DE 1 GRAU TARCISIO SOARES PALMEIRA|TRAVESSA SENADOR MAXIMO, 104",0.6212,SEM_MATCH
UNIAO DOS PALMARES,CRECHE MUNICIPAL TIA SUZETE,108,UNIAO DOS PALMARES|CRECHE MUNICIPAL TIA SUZETE|CONJUNTO NOVA ESPERANCA,0.5567,SEM_MATCH
ARAPIRACA,ESCOLA DE ENSINO FUNDAMENTAL GUIMARÃES PASSOS,106,ARAPIRACA|ESCOLA DE ENSINO FUNDAMENTAL GUIMARAES PASSOS|VILA FERNANDES,0.7826,MATCH_FRACO
MARECHAL DEODORO,NEI ADÉLIA CAVALCANTE COSTA,106,MARECHAL DEODORO|NEI ADELIA CAVALCANTE COSTA|RUA DOS CAJUEIROS,0.6067,SEM_MATCH
UNIAO DOS PALMARES,ESCOLA DE ENSINO FUNDAMENTAL FERNANDO JUAZEIRO,106,"MACEIO|ESCOLA DE ENSINO FUNDAMENTAL PEDRO SURUAGY|AV. MACEIO, S/N",0.6972,SEM_MATCH
SAO MIGUEL DOS CAMPOS,ESCOLA ESTADUAL PROFESSORA EDILEUZA OLIVEIRA DA SILVA,101,"SAO MIGUEL DOS CAMPOS|ESCOLA ESTADUAL PROFESSORA EDILEUZA OLIVEIRA DA SILVA|RUA PROJETADA, S/N",0.726,SEM_MATCH
PALMEIRA DOS INDIOS,GRUPO ESCOLAR ANTÔNIA MACEDO,101,PALMEIRA DOS INDIOS|GRUPO ESCOLAR ANTONIA MACEDO|RUA CEL ANTONIO PANTALEAO SN,0.5333,SEM_MATCH
MACEIO,COLÉGIO DOM BOSCO (ANTIGO COLÉGIO CARVALHO),99,MACEIO|COLEGIO DOM BOSCO (ANTIGO COLEGIO CARVALHO)|RUA EURICO AYRES N. 131,0.7321,SEM_MATCH
MACEIO,ESC. EST. PROFª EROTILDES RODRIGUES SALDANHA (EX SEN PETRÔNIO PORTELA),99,"MACEIO|ESC. EST. PROFa EROTILDES RODRIGUES SALDANHA (EX SEN PETRONIO PORTELA)|RUA GOV. LAMENHA FILHO, S/N",0.8,MATCH_FRACO
MACEIO,COLÉGIO ROSA MÍSTICA,99,"MACEIO|COLEGIO INTENSIVO|LARGO DA VITORIA, 215",0.4923,SEM_MATCH
MACEIO,CMEI SÔNIA CAVALCANTI,98,MARECHAL DEODORO|NEI TANIA CAVALCANTE|AV CATUCABA SN,0.4658,SEM_MATCH
MACEIO,ESCOLA ESTADUAL MARIA AMÁLIA,98,RIO LARGO|ESCOLA ESTADUAL TABULEIRO DO PINTO|RUA DA CAIXA SN,0.5682,SEM_MATCH
PENEDO,IFAL - CAMPUS PENEDO,96,"MACEIO|IFAL - CAMPUS BENEDITO BENTES|AVENIDA BENEDITO BENTES, S/N",0.425,SEM_MATCH
MARECHAL DEODORO,NEI MARIA IRENE DA SILVA,96,MARECHAL DEODORO|NEI MARIA IRENE DA SILVA|AV VIOLETA SN RD DENISSON AMORIM,0.4898,SEM_MATCH
PALMEIRA DOS INDIOS,ESCOLA ESTADUAL MANOEL PASSOS LIMA,95,"PALMEIRA DOS INDIOS|ESCOLA ESTADUAL MANOEL PASSOS LIMA|RUA GERVASIO MOREIRA, S/N",0.6018,SEM_MATCH
PENEDO,FACULDADE RAIMUNDO MARINHO DE PENEDO,92,"PENEDO|FACULDADE RAIMUNDO MARINHO DE PENEDO|RUA 15 DE NOVEMBRO, FRM",0.7059,SEM_MATCH
MACEIO,ESC. MUN. NOSSA SRª APARECIDA (PRÉDIO DO ANTIGO COL.SAGRADA FAMÍLIA),91,"MACEIO|ESC. MUN. NOSSA SRa APARECIDA (PREDIO DO ANTIGO COL.SAGRADA FAMILIA)|RUA PROFESSORA MARIA JOSE LOUREIRO, S/N",0.7459,SEM_MATCH
MACEIO,ESCOLA EST. DOM ADELMO MACHADO,89,"MACEIO|ESCOLA EST. DOM ADELMO MACHADO|RUA DOM ADELMO MACHADO, S/N",0.6304,SEM_MATCH
RIO LARGO,CMEI DESEMBARGADOR FRANCISCO WILDO LACERDA DANTAS,88,"RIO LARGO|CMEI DESEMBARGADOR FRANCISCO WILDO LACERDA DANTAS|CJ ANTONIO LINS DE SOUSA , QD6, MATA DO ROLO",0.6533,SEM_MATCH
DELMIRO GOUVEIA,"NOEMIA BANDEIRA DA SILVA,ESCOLA",86,"DELMIRO GOUVEIA|NOEMIA BANDEIRA DA SILVA,ESCOLA|RUA DO CHAFARIZ, SN",0.6392,SEM_MATCH
MACEIO,ESC. MUN. PROFª NEIDE DE FREITAS FRANÇA,84,"MACEIO|ESC. MUN. PROFa NEIDE DE FREITAS FRANCA|CONJ. OTACILIO HOLANDA, S/N",0.6964,SEM_MATCH
MACEIO,SEADES - SEC. DE EST. DA ASSISTÊNCIA E DESENVOLVIMENTO SOCIAL,84,MACEIO|SEADES - SEC. DE EST. DA ASSISTENCIA E DESENVOLVIMENTO SOCIAL|RUA COMENDADOR CALACA 1339,0.7703,MATCH_FRACO
MACEIO,GRUPO ESCOLAR ANTÔNIO VASCO,82,"MACEIO|GRUPO ESCOLAR ANTONIO VASCO|PRACA JOSE EMIDIO DE CARVALHO, S/N",0.5684,SEM_MATCH
MACEIO,ESCOLA ESTADUAL MAJOR EDUARDO EMILIANO DA FONSECA,82,"MACEIO|ESCOLA ESTADUAL MAJOR EDUARDO EMILIANO DA FONSECA|RUA DR LUIS DE BARROS, S/N",0.7259,SEM_MATCH
PENEDO,GRUPO ESCOLAR ESTADUAL GABINO BESOURO,81,"PENEDO|GRUPO ESCOLAR ESTADUAL GABINO BESOURO|AVENIDA NILO PECANHA, 182, PROXIMO AO TIRO DE GUERRA",0.5606,SEM_MATCH
