municipio,local_sem_geo,registros_afetados,melhor_correspondencia_cache,score_similaridade,status_match
MARECHAL DEODORO,ESCOLA PROFESSORA ELEUZA GALVÃO RODAS,79,MARECHAL DEODORO|ESCOLA PROFESSORA ELEUZA GALVAO RODAS|RUA ARTHUR PAIVA REGO SN,0.6379,SEM_MATCH
DELMIRO GOUVEIA,ESCOLA ESTADUAL PEDRO NEPOMUCENO DOS SANTOS,79,"DELMIRO GOUVEIA|ESCOLA ESTADUAL PEDRO NEPOMUCENO DOS SANTOS|RUA PROJETADA, S/N. DISTRITO DE BARRAGEM LESTE",0.585,SEM_MATCH
CORURIPE,ESCOLA MUNICIPAL GENERAL DE GOIS MONTEIRO,77,"CORURIPE|ESCOLA MUNICIPAL GENERAL DE GOIS MONTEIRO|RUA ABELARDO HOLANDA, 105",0.7069,SEM_MATCH
MARECHAL DEODORO,ESCOLA MUNICIPAL PREFEITO EDIVAL LEMOS SANTOS,76,MARECHAL DEODORO|ESCOLA MUNICIPAL PREFEITO EDIVAL LEMOS SANTOS|AV. SAO JOSE POEIRA SN,0.6977,SEM_MATCH
RIO LARGO,CRIA-CENTRO INFANTIL CORÁLIA GOMES DA SILVA,76,"RIO LARGO|CRIA-CENTRO INFANTIL CORALIA GOMES DA SILVA|CJ JARBAS OITICICA, QD B2, N 45, MATA DO ROLO",0.6187,SEM_MATCH
CORURIPE,ESCOLA MUNICIPAL NOSSA SENHORA DO MONT SERRAT,71,"CORURIPE|ESCOLA MUNICIPAL NOSSA SENHORA DO MONT SERRAT|POVOADO MIAI DE BAIXO, S/N",0.72,SEM_MATCH
DELMIRO GOUVEIA,"ANCHIETA, GRUPO ESCOLAR PADRE ( POV. LAGOINHA)",69,"DELMIRO GOUVEIA|ANCHIETA, GRUPO ESCOLAR PADRE ( POV. LAGOINHA)|POVOADO LAGOINHAS S/N",0.6833,SEM_MATCH
UNIAO DOS PALMARES,ESCOLA MUNICIPAL LAURA PEREIRA DA SILVA,66,"UNIAO DOS PALMARES|ESCOLA MUNICIPAL LAURA PEREIRA DA SILVA|RUA CUPERTINO DOS PRAZERES, S/N",0.6094,SEM_MATCH
PENEDO,ESCOLA ESTADUAL HERMÍLIO DE FREITAS MELRO,62,"MACEIO|ESCOLA ESTADUAL ROTARY|AV. DURVAL DE GOES MONTEIRO, S/N",0.5743,SEM_MATCH
MACEIO,COLÉGIO SÃO JERÔNIMO,62,"MACEIO|COLEGIO DINAMICO|AVENIDA MACEIO, N 83",0.5079,SEM_MATCH
PENEDO,UNIDADE DE ENSINO DE PENEDO/UFAL,58,"PENEDO|UNIDADE DE ENSINO DE PENEDO/UFAL|AVENIDA BEIRA RIO, S/N, UFAL, PX. A DELEGACIA DE POLICIA",0.5161,SEM_MATCH
MACEIO,ESCOLA MUNICIPAL JOÃO FEITOSA,57,"MACEIO|ESCOLA MUNICIPAL TOBIAS GRANJA|RUA SAO JOSE, 888",0.5542,SEM_MATCH
DELMIRO GOUVEIA,"ERENICE GOMES DE LIMA, ESCOLA ESTADUAL PROFª",55,"DELMIRO GOUVEIA|ERENICE GOMES DE LIMA, ESCOLA ESTADUAL PROFa|RUA MARTINHA CARDEAL S/N",0.6667,SEM_MATCH
PALMEIRA DOS INDIOS,ESCOLA ESTADUAL DIJANIRA SANTOS SILVA,52,PALMEIRA DOS INDIOS|ESCOLA ESTADUAL DIJANIRA SANTOS SILVA|POVOADO SANTO ANTONIO,0.6379,SEM_MATCH
DELMIRO GOUVEIA,"MANOEL MOURA, COLEGIO DE 1 GRAU",52,"DELMIRO GOUVEIA|MANOEL MOURA, COLEGIO DE 1 GRAU|POVOADO BARRAGEM",0.6452,SEM_MATCH
DELMIRO GOUVEIA,"JOSE CORREIA DOS SANTOS,GRUPO ESCOLAR",51,"DELMIRO GOUVEIA|JOSE CORREIA DOS SANTOS,GRUPO ESCOLAR|POVOADO SINIMBU",0.6981,SEM_MATCH
PENEDO,EMEB HANNA BERTHOLET,50,PENEDO|EMEB HANNA BERTHOLET|POVOADO SANTA MARGARIDA,0.5634,SEM_MATCH
MARECHAL DEODORO,ESCOLA MUNICIPAL ADELINA DE CARVALHO MELO,47,MARECHAL DEODORO|ESCOLA MUNICIPAL ADELINA DE CARVALHO MELO|RUA ADELINA DE CARVALHO MELO SN,0.626,SEM_MATCH
MARECHAL DEODORO,UBS - MARIA DO CARMO ARAÚJO SOARES,45,"MARECHAL DEODORO|UBS - MARIA DO CARMO ARAUJO SOARES|RUA ADELINA DE CARVALHO MELO, S/N",0.5614,SEM_MATCH
DELMIRO GOUVEIA,GRUPO ESCOLAR CASTRO ALVES,41,DELMIRO GOUVEIA|GRUPO ESCOLAR CASTRO ALVES|POVOADO BARRAGEM,0.6118,SEM_MATCH
DELMIRO GOUVEIA,"JOSE CORREIA FILHO,ESCOLA",39,"DELMIRO GOUVEIA|JOSE CORREIA FILHO,ESCOLA|POVOADO JARDIM CORDEIRO",0.5556,SEM_MATCH
MACEIO,CRECHE AGENOR FERNANDES PONTES,39,"MACEIO|CRECHE AGENOR FERNANDES PONTES|VILA GOIABEIRA, 132",0.6977,SEM_MATCH
DELMIRO GOUVEIA,"RUI BARBOSA,ESCOLA MUNICIPAL",37,"DELMIRO GOUVEIA|RUI BARBOSA,ESCOLA MUNICIPAL|POVOADO SAO SEBASTIAO",0.5957,SEM_MATCH
PENEDO,ESCOLA ESTADUAL CLEMENTINO DO MONTE,35,"MACEIO|ESCOLA ESTADUAL ROTARY|AV. DURVAL DE GOES MONTEIRO, S/N",0.5474,SEM_MATCH
PALMEIRA DOS INDIOS,ESCOLA MUNICIPAL NOÉ SIMPLÍCIO,34,PALMEIRA DOS INDIOS|ESCOLA MUNICIPAL NOE SIMPLICIO|POVOADO BONIFACIO,0.6122,SEM_MATCH
PALMEIRA DOS INDIOS,ESCOLA ESTADUAL EGÍDIO BARBOSA,32,"MACEIO|E.E. DOM OTAVIO BARBOSA AGUIAR|RUA A-20, S/N",0.5934,SEM_MATCH
PALMEIRA DOS INDIOS,ESCOLA MUNICIPAL PEDRO RODRIGUES GAIA,31,PALMEIRA DOS INDIOS|ESCOLA MUNICIPAL PEDRO RODRIGUES GAIA|POVOADO CORURIPE DA CAL,0.6271,SEM_MATCH
DELMIRO GOUVEIA,"RAIMYSON SILVA NASCIMENTO, EMEF",30,"DELMIRO GOUVEIA|RAIMYSON SILVA NASCIMENTO, EMEF|POVOADO CARAIBEIRINHAS",0.6061,SEM_MATCH
DELMIRO GOUVEIA,"SAO JOSE, ESCOLA MUN DE ENSINO FUNDAMENTAL",29,"DELMIRO GOUVEIA|SAO JOSE, ESCOLA MUN DE ENSINO FUNDAMENTAL|POVOADO SALGADO",0.7193,SEM_MATCH
PENEDO,EMEB SANTO ANTÔNIO,28,PENEDO|EMEB SANTO ANTONIO|POVOADO TABULEIRO DOS NEGROS,0.5,SEM_MATCH
PALMEIRA DOS INDIOS,UNIVERSISADE ESTADUAL DE ALAGOAS - UNEAL - PALMERIA DOS ÍNDIOS,26,"PALMEIRA DOS INDIOS|UNIVERSISADE ESTADUAL DE ALAGOAS - UNEAL - PALMERIA DOS INDIOS|RODOVIA EDUARDO ALVES DA SILVA, KM 03",0.6705,SEM_MATCH
DELMIRO GOUVEIA,"ANTENOR CORREIA SERPA, ESCOLA MUNICIPAL DR.",25,"DELMIRO GOUVEIA|ANTENOR CORREIA SERPA, ESCOLA MUNICIPAL DR.|POVOADO CRUZ",0.7563,MATCH_FRACO
PENEDO,EMEB PROFª MARIA DA GLÓRIA PIMENTEIRA,24,PENEDO|EMEB PROFa MARIA DA GLORIA PIMENTEIRA|POVOADO PONTA MOFINA,0.7129,SEM_MATCH
DELMIRO GOUVEIA,ESCOLA MUNICIPAL DE EDUCAÇÃO BÁSICA JUSCELINO KUBISTCHEK DE OLIVEIRA,23,DELMIRO GOUVEIA|ESCOLA MUNICIPAL DE EDUCACAO BASICA JUSCELINO KUBISTCHEK DE OLIVEIRA|POVOADO ALTO BONITO,0.7907,MATCH_FRACO
PENEDO,EMEB PROFESSOR IRÊNIO ARAÚJO,17,PENEDO|EMEB PROFESSOR IRENIO ARAUJO|POVOADO MARITUBA DO PEIXE,0.6292,SEM_MATCH
