prioridade,prioridade_recalculada,tipo_pendencia,municipio,local_sem_geo,melhor_local_cache,endereco_cache,consulta_geocoding,registros_afetados,score_similaridade,status_match,status_geocodificacao,latitude_curadoria,longitude_curadoria,bairro_curadoria,status_curadoria,fonte_validacao,observacao_curadoria
PRIORIDADE_3,PRIORIDADE_3,ESCOLA_URBANA_OU_SEDE,MARECHAL DEODORO,ESCOLA MUNICIPAL CARLOS AVELINO DA SILVA,ESCOLA MUNICIPAL CARLOS AVELINO DA SILVA,"RES MARIA GISLENE MATHEUS, S/N","RES MARIA GISLENE MATHEUS, S/N, Marechal Deodoro, Alagoas, Brasil",126,1.0,MATCH_FORTE,NAO_ENCONTRADO,,,,PENDENTE,,
PRIORIDADE_3,PRIORIDADE_3,OUTROS,ARAPIRACA,IFAL - INSTITUTO FEDERAL DE ALAGOAS,IFAL - INSTITUTO FEDERAL DE ALAGOAS,"RODOVIA AL 110, N 4805","RODOVIA AL 110, N 4805, Arapiraca, Alagoas, Brasil",125,1.0,MATCH_FORTE,NAO_ENCONTRADO,,,,PENDENTE,,
PRIORIDADE_3,PRIORIDADE_3,CONJUNTO_HABITACIONAL,RIO LARGO,ESCOLA DE EDUCAÇÃO INFANTIL PADRE PAULINO,ESCOLA DE EDUCACAO INFANTIL PADRE PAULINO,CONJUNTO MUTIRAO,"CONJUNTO MUTIRÃO, Rio Largo, Alagoas, Brasil",125,1.0,MATCH_FORTE,NAO_ENCONTRADO,,,,PENDENTE,,
PRIORIDADE_3,PRIORIDADE_3,SITIO,MACEIO,ESC. EST. PROFª ANA COELHO PALMEIRA,ESC. EST. PROFa ANA COELHO PALMEIRA,"CONJ. ALFREDO GASPAR DE MENDONCA, S/N","CONJ. ALFREDO GASPAR DE MENDONCA, S/N, Maceio, Alagoas, Brasil",124,0.9302,MATCH_PROVAVEL,NAO_ENCONTRADO,,,,PENDENTE,,
PRIORIDADE_3,PRIORIDADE_3,LOTEAMENTO,PENEDO,EMEB VEREADOR JOSÉ DA COSTA MANGABEIRA,EMEB VEREADOR JOSE DA COSTA MANGABEIRA,"RUA F, LOTEAMENTO SAO GONCALO, SN","RUA F, LOTEAMENTO SÃO GONÇALO, SN, Penedo, Alagoas, Brasil",122,1.0,MATCH_FORTE,NAO_ENCONTRADO,,,,PENDENTE,,
PRIORIDADE_3,PRIORIDADE_3,ESCOLA_URBANA_OU_SEDE,PENEDO,ESCOLA ESTADUAL DR. ALCIDES ANDRADE,ESCOLA ESTADUAL DR. ALCIDES ANDRADE,"ROD. ENGENHEIRO JOAQUIM GONCALVES, S/N, PX. A GRANDE RIO VEICULOS","ROD. ENGENHEIRO JOAQUIM GONÇALVES, S/N, PX. A GRANDE RIO VEÍCULOS, Penedo, Alagoas, Brasil",122,1.0,MATCH_FORTE,NAO_ENCONTRADO,,,,PENDENTE,,
PRIORIDADE_3,PRIORIDADE_3,VILA,RIO LARGO,ESCOLA DE EDUCAÇÃO INFANTIL AQUINO JAPIASSÚ,ESCOLA DE EDUCACAO INFANTIL AQUINO JAPIASSU,VILA MARILIA,"VILA MARÍLIA, Rio Largo, Alagoas, Brasil",120,1.0,MATCH_FORTE,NAO_ENCONTRADO,,,,PENDENTE,,
PRIORIDADE_3,PRIORIDADE_3,ENDERECO_URBANO,ARAPIRACA,CENTRO DE EDUCAÇÃO INFANTIL MARIA DE LOURDES PEREIRA CAVALCANTE,CENTRO DE EDUCACAO INFANTIL MARIA DE LOURDES PEREIRA CAVALCANTE,"RUA OSMAN CAVALCANTE, S/N","RUA OSMAN CAVALCANTE, S/N, Arapiraca, Alagoas, Brasil",115,1.0,MATCH_FORTE,NAO_ENCONTRADO,,,,PENDENTE,,
PRIORIDADE_3,PRIORIDADE_3,OUTROS,MACEIO,CMEI HERBERT DE SOUZA,CMEI HERBERT DE SOUZA,"ROD. AL 101 NORTE, S/N","ROD. AL 101 NORTE, S/N, Maceio, Alagoas, Brasil",115,1.0,MATCH_FORTE,NAO_ENCONTRADO,,,,PENDENTE,,
PRIORIDADE_3,PRIORIDADE_3,ESCOLA_URBANA_OU_SEDE,SAO MIGUEL DOS CAMPOS,ESCOLA DE 1 E 2 GRAUS NUNILA MACHADO,ESCOLA DE 1 E 2 GRAUS NUNILA MACHADO,"VISCONDE DE SINIMBU, 182","VISCONDE DE SINIMBU, 182, Sao Miguel Dos Campos, Alagoas, Brasil",115,1.0,MATCH_FORTE,NAO_ENCONTRADO,,,,PENDENTE,,
PRIORIDADE_3,PRIORIDADE_3,ESCOLA_URBANA_OU_SEDE,DELMIRO GOUVEIA,"FRANCISCA ROSA DA COSTA,GRUPO ESCOLAR","FRANCISCA ROSA DA COSTA,GRUPO ESCOLAR","RUA SARGENTO REGINALDO BANDEIRA, 342","RUA SARGENTO REGINALDO BANDEIRA, 342, Delmiro Gouveia, Alagoas, Brasil",113,1.0,MATCH_FORTE,NAO_ENCONTRADO,,,,PENDENTE,,
PRIORIDADE_3,PRIORIDADE_3,ESCOLA_URBANA_OU_SEDE,MACEIO,E.E. AQUILINA BULHÕES BARROS,E.E. AQUILINA BULHOES BARROS,"RUA HENRIQUE FRANCISCO BULHOES, 14 QD C","RUA HENRIQUE FRANCISCO BULHÕES, 14 QD C, Maceio, Alagoas, Brasil",111,1.0,MATCH_FORTE,NAO_ENCONTRADO,,,,PENDENTE,,
PRIORIDADE_3,PRIORIDADE_3,ESCOLA_URBANA_OU_SEDE,SAO MIGUEL DOS CAMPOS,ESCOLA DE 1 GRAU TARCISIO SOARES PALMEIRA,ESCOLA DE 1 GRAU TARCISIO SOARES PALMEIRA,"TRAVESSA SENADOR MAXIMO, 104","TRAVESSA SENADOR MAXIMO, 104, Sao Miguel Dos Campos, Alagoas, Brasil",110,1.0,MATCH_FORTE,NAO_ENCONTRADO,,,,PENDENTE,,
PRIORIDADE_3,PRIORIDADE_3,CONJUNTO_HABITACIONAL,UNIAO DOS PALMARES,CRECHE MUNICIPAL TIA SUZETE,CRECHE MUNICIPAL TIA SUZETE,CONJUNTO NOVA ESPERANCA,"CONJUNTO NOVA ESPERANÇA, Uniao Dos Palmares, Alagoas, Brasil",108,1.0,MATCH_FORTE,NAO_ENCONTRADO,,,,PENDENTE,,
PRIORIDADE_3,PRIORIDADE_3,VILA,ARAPIRACA,ESCOLA DE ENSINO FUNDAMENTAL GUIMARÃES PASSOS,ESCOLA DE ENSINO FUNDAMENTAL GUIMARAES PASSOS,VILA FERNANDES,"VILA FERNANDES, Arapiraca, Alagoas, Brasil",106,1.0,MATCH_FORTE,NAO_ENCONTRADO,,,,PENDENTE,,
PRIORIDADE_3,PRIORIDADE_3,ENDERECO_URBANO,MARECHAL DEODORO,NEI ADÉLIA CAVALCANTE COSTA,NEI ADELIA CAVALCANTE COSTA,RUA DOS CAJUEIROS,"RUA DOS CAJUEIROS, Marechal Deodoro, Alagoas, Brasil",106,1.0,MATCH_FORTE,NAO_ENCONTRADO,,,,PENDENTE,,
PRIORIDADE_3,PRIORIDADE_3,ESCOLA_URBANA_OU_SEDE,UNIAO DOS PALMARES,ESCOLA DE ENSINO FUNDAMENTAL FERNANDO JUAZEIRO,ESCOLA DE ENSINO FUNDAMENTAL FERNANDO JUAZEIRO,AV. DR. HERMANO PLECH 488,"AV. DR. HERMANO PLECH 488, Uniao Dos Palmares, Alagoas, Brasil",106,1.0,MATCH_FORTE,NAO_ENCONTRADO,,,,PENDENTE,,
PRIORIDADE_3,PRIORIDADE_3,ESCOLA_URBANA_OU_SEDE,PALMEIRA DOS INDIOS,GRUPO ESCOLAR ANTÔNIA MACEDO,GRUPO ESCOLAR ANTONIA MACEDO,RUA CEL ANTONIO PANTALEAO SN,"RUA CEL ANTÔNIO PANTALEÃO SN, Palmeira Dos Indios, Alagoas, Brasil",101,1.0,MATCH_FORTE,NAO_ENCONTRADO,,,,PENDENTE,,
PRIORIDADE_3,PRIORIDADE_3,ESCOLA_URBANA_OU_SEDE,SAO MIGUEL DOS CAMPOS,ESCOLA ESTADUAL PROFESSORA EDILEUZA OLIVEIRA DA SILVA,ESCOLA ESTADUAL PROFESSORA EDILEUZA OLIVEIRA DA SILVA,"RUA PROJETADA, S/N","RUA PROJETADA, S/N, Sao Miguel Dos Campos, Alagoas, Brasil",101,1.0,MATCH_FORTE,NAO_ENCONTRADO,,,,PENDENTE,,
PRIORIDADE_3,PRIORIDADE_3,ESCOLA_URBANA_OU_SEDE,MACEIO,COLÉGIO DOM BOSCO (ANTIGO COLÉGIO CARVALHO),COLEGIO DOM BOSCO (ANTIGO COLEGIO CARVALHO),RUA EURICO AYRES N. 131,"RUA EURICO AYRES N. 131, Maceio, Alagoas, Brasil",99,1.0,MATCH_FORTE,NAO_ENCONTRADO,,,,PENDENTE,,
PRIORIDADE_3,PRIORIDADE_3,CONJUNTO_HABITACIONAL,MACEIO,COLÉGIO ROSA MÍSTICA,COLEGIO ROSA MISTICA,"CONJUNTO OSMAN LOUREIRO, RUA 15, N 133, QD C2","CONJUNTO OSMAN LOUREIRO, RUA 15, N 133, QD C2, Maceio, Alagoas, Brasil",99,1.0,MATCH_FORTE,NAO_ENCONTRADO,,,,PENDENTE,,
PRIORIDADE_3,PRIORIDADE_3,SITIO,MACEIO,ESC. EST. PROFª EROTILDES RODRIGUES SALDANHA (EX SEN PETRÔNIO PORTELA),ESC. EST. PROFa EROTILDES RODRIGUES SALDANHA (EX SEN PETRONIO PORTELA),"RUA GOV. LAMENHA FILHO, S/N","RUA GOV. LAMENHA FILHO, S/N, Maceio, Alagoas, Brasil",99,0.9605,MATCH_FORTE,NAO_ENCONTRADO,,,,PENDENTE,,
PRIORIDADE_3,PRIORIDADE_3,ENDERECO_URBANO,MACEIO,CMEI SÔNIA CAVALCANTI,CMEI SONIA CAVALCANTI,"RUA GENERAL HERMES, S/N, BOM PARTO (VIZ. A SEMED)","RUA GENERAL HERMES, S/N, BOM PARTO (VIZ. À SEMED), Maceio, Alagoas, Brasil",98,1.0,MATCH_FORTE,NAO_ENCONTRADO,,,,PENDENTE,,
PRIORIDADE_3,PRIORIDADE_3,VILA,MACEIO,ESCOLA ESTADUAL MARIA AMÁLIA,ESCOLA ESTADUAL MARIA AMALIA,"RUA VALDEMAR RUFINO DOS SANTOS, S/N,VILA ABC","RUA VALDEMAR RUFINO DOS SANTOS, S/N,VILA ABC, Maceio, Alagoas, Brasil",98,1.0,MATCH_FORTE,NAO_ENCONTRADO,,,,PENDENTE,,
PRIORIDADE_3,PRIORIDADE_3,OUTROS,MARECHAL DEODORO,NEI MARIA IRENE DA SILVA,NEI MARIA IRENE DA SILVA,AV VIOLETA SN RD DENISSON AMORIM,"AV VIOLETA SN RD DENISSON AMORIM, Marechal Deodoro, Alagoas, Brasil",96,1.0,MATCH_FORTE,NAO_ENCONTRADO,,,,PENDENTE,,
PRIORIDADE_3,PRIORIDADE_3,OUTROS,PENEDO,IFAL - CAMPUS PENEDO,IFAL - CAMPUS PENEDO,"ROD ENGENHEIRO JOAQUIM GONCALVES, S/N LOT SAO JOSE","ROD ENGENHEIRO JOAQUIM GONÇALVES, S/N LOT SÃO JOSÉ, Penedo, Alagoas, Brasil",96,1.0,MATCH_FORTE,NAO_ENCONTRADO,,,,PENDENTE,,
PRIORIDADE_3,PRIORIDADE_3,ESCOLA_URBANA_OU_SEDE,PALMEIRA DOS INDIOS,ESCOLA ESTADUAL MANOEL PASSOS LIMA,ESCOLA ESTADUAL MANOEL PASSOS LIMA,"RUA GERVASIO MOREIRA, S/N","RUA GERVÁSIO MOREIRA, S/N, Palmeira Dos Indios, Alagoas, Brasil",95,1.0,MATCH_FORTE,NAO_ENCONTRADO,,,,PENDENTE,,
PRIORIDADE_3,PRIORIDADE_3,ESCOLA_URBANA_OU_SEDE,MACEIO,ESC. MUN. NOSSA SRª APARECIDA (PRÉDIO DO ANTIGO COL.SAGRADA FAMÍLIA),ESC. MUN. NOSSA SRa APARECIDA (PREDIO DO ANTIGO COL.SAGRADA FAMILIA),"RUA PROFESSORA MARIA JOSE LOUREIRO, S/N","RUA PROFESSORA MARIA JOSÉ LOUREIRO, S/N, Maceio, Alagoas, Brasil",91,0.9934,MATCH_FORTE,NAO_ENCONTRADO,,,,PENDENTE,,
PRIORIDADE_3,PRIORIDADE_3,CONJUNTO_HABITACIONAL,RIO LARGO,CMEI DESEMBARGADOR FRANCISCO WILDO LACERDA DANTAS,CMEI DESEMBARGADOR FRANCISCO WILDO LACERDA DANTAS,"CJ ANTONIO LINS DE SOUSA , QD6, MATA DO ROLO","CJ ANTONIO LINS DE SOUSA , QD6, MATA DO ROLO, Rio Largo, Alagoas, Brasil",88,1.0,MATCH_FORTE,NAO_ENCONTRADO,,,,PENDENTE,,
PRIORIDADE_3,PRIORIDADE_3,ESCOLA_URBANA_OU_SEDE,DELMIRO GOUVEIA,"NOEMIA BANDEIRA DA SILVA,ESCOLA","NOEMIA BANDEIRA DA SILVA,ESCOLA","RUA DO CHAFARIZ, SN","RUA DO CHAFARIZ, SN, Delmiro Gouveia, Alagoas, Brasil",86,1.0,MATCH_FORTE,NAO_ENCONTRADO,,,,PENDENTE,,
PRIORIDADE_3,PRIORIDADE_3,CONJUNTO_HABITACIONAL,MACEIO,ESC. MUN. PROFª NEIDE DE FREITAS FRANÇA,ESC. MUN. PROFa NEIDE DE FREITAS FRANCA,"CONJ. OTACILIO HOLANDA, S/N","CONJ. OTACILIO HOLANDA, S/N, Maceio, Alagoas, Brasil",84,0.9375,MATCH_PROVAVEL,NAO_ENCONTRADO,,,,PENDENTE,,
PRIORIDADE_3,PRIORIDADE_3,SITIO,MACEIO,SEADES - SEC. DE EST. DA ASSISTÊNCIA E DESENVOLVIMENTO SOCIAL,SEADES - SEC. DE EST. DA ASSISTENCIA E DESENVOLVIMENTO SOCIAL,RUA COMENDADOR CALACA 1339,"RUA COMENDADOR CALACA 1339, Maceio, Alagoas, Brasil",84,1.0,MATCH_FORTE,NAO_ENCONTRADO,,,,PENDENTE,,
PRIORIDADE_3,PRIORIDADE_3,ESCOLA_URBANA_OU_SEDE,MACEIO,ESCOLA ESTADUAL MAJOR EDUARDO EMILIANO DA FONSECA,ESCOLA ESTADUAL MAJOR EDUARDO EMILIANO DA FONSECA,"RUA DR LUIS DE BARROS, S/N","RUA DR LUIS DE BARROS, S/N, Maceio, Alagoas, Brasil",82,1.0,MATCH_FORTE,NAO_ENCONTRADO,,,,PENDENTE,,
PRIORIDADE_3,PRIORIDADE_3,ESCOLA_URBANA_OU_SEDE,PENEDO,GRUPO ESCOLAR ESTADUAL GABINO BESOURO,GRUPO ESCOLAR ESTADUAL GABINO BESOURO,"AVENIDA NILO PECANHA, 182, PROXIMO AO TIRO DE GUERRA","AVENIDA NILO PECANHA, 182, PRÓXIMO AO TIRO DE GUERRA, Penedo, Alagoas, Brasil",81,1.0,MATCH_FORTE,NAO_ENCONTRADO,,,,PENDENTE,,
PRIORIDADE_3,PRIORIDADE_3,ESCOLA_URBANA_OU_SEDE,DELMIRO GOUVEIA,ESCOLA ESTADUAL PEDRO NEPOMUCENO DOS SANTOS,ESCOLA ESTADUAL PEDRO NEPOMUCENO DOS SANTOS,"RUA PROJETADA, S/N. DISTRITO DE BARRAGEM LESTE","RUA PROJETADA, S/N. DISTRITO DE BARRAGEM LESTE, Delmiro Gouveia, Alagoas, Brasil",79,1.0,MATCH_FORTE,NAO_ENCONTRADO,,,,PENDENTE,,
PRIORIDADE_3,PRIORIDADE_3,ESCOLA_URBANA_OU_SEDE,MARECHAL DEODORO,ESCOLA PROFESSORA ELEUZA GALVÃO RODAS,ESCOLA PROFESSORA ELEUZA GALVAO RODAS,RUA ARTHUR PAIVA REGO SN,"RUA ARTHUR PAIVA REGO SN, Marechal Deodoro, Alagoas, Brasil",79,1.0,MATCH_FORTE,NAO_ENCONTRADO,,,,PENDENTE,,
PRIORIDADE_3,PRIORIDADE_3,ESCOLA_URBANA_OU_SEDE,CORURIPE,ESCOLA MUNICIPAL GENERAL DE GOIS MONTEIRO,ESCOLA MUNICIPAL GENERAL DE GOIS MONTEIRO,"RUA ABELARDO HOLANDA, 105","RUA ABELARDO HOLANDA, 105, Coruripe, Alagoas, Brasil",77,1.0,MATCH_FORTE,NAO_ENCONTRADO,,,,PENDENTE,,
PRIORIDADE_3,PRIORIDADE_3,ESCOLA_URBANA_OU_SEDE,MARECHAL DEODORO,ESCOLA MUNICIPAL PREFEITO EDIVAL LEMOS SANTOS,ESCOLA MUNICIPAL PREFEITO EDIVAL LEMOS SANTOS,AV. SAO JOSE POEIRA SN,"AV. SAO JOSE POEIRA SN, Marechal Deodoro, Alagoas, Brasil",76,1.0,MATCH_FORTE,NAO_ENCONTRADO,,,,PENDENTE,,
PRIORIDADE_3,PRIORIDADE_3,CONJUNTO_HABITACIONAL,RIO LARGO,CRIA-CENTRO INFANTIL CORÁLIA GOMES DA SILVA,CRIA-CENTRO INFANTIL CORALIA GOMES DA SILVA,"CJ JARBAS OITICICA, QD B2, N 45, MATA DO ROLO","CJ JARBAS OITICICA, QD B2, N 45, MATA DO ROLO, Rio Largo, Alagoas, Brasil",76,1.0,MATCH_FORTE,NAO_ENCONTRADO,,,,PENDENTE,,
PRIORIDADE_3,PRIORIDADE_3,POVOADO,CORURIPE,ESCOLA MUNICIPAL NOSSA SENHORA DO MONT SERRAT,ESCOLA MUNICIPAL NOSSA SENHORA DO MONT SERRAT,"POVOADO MIAI DE BAIXO, S/N","POVOADO MIAI DE BAIXO, S/N, Coruripe, Alagoas, Brasil",71,1.0,MATCH_FORTE,NAO_ENCONTRADO,,,,PENDENTE,,
PRIORIDADE_3,PRIORIDADE_3,POVOADO,DELMIRO GOUVEIA,"ANCHIETA, GRUPO ESCOLAR PADRE ( POV. LAGOINHA)","ANCHIETA, GRUPO ESCOLAR PADRE ( POV. LAGOINHA)",POVOADO LAGOINHAS S/N,"POVOADO LAGOINHAS S/N, Delmiro Gouveia, Alagoas, Brasil",69,1.0,MATCH_FORTE,NAO_ENCONTRADO,,,,PENDENTE,,
PRIORIDADE_3,PRIORIDADE_3,ESCOLA_URBANA_OU_SEDE,UNIAO DOS PALMARES,ESCOLA MUNICIPAL LAURA PEREIRA DA SILVA,ESCOLA MUNICIPAL LAURA PEREIRA DA SILVA,"RUA CUPERTINO DOS PRAZERES, S/N","RUA CUPERTINO DOS PRAZERES, S/N, Uniao Dos Palmares, Alagoas, Brasil",66,1.0,MATCH_FORTE,NAO_ENCONTRADO,,,,PENDENTE,,
PRIORIDADE_3,PRIORIDADE_3,ESCOLA_URBANA_OU_SEDE,PENEDO,ESCOLA ESTADUAL HERMÍLIO DE FREITAS MELRO,ESCOLA ESTADUAL HERMILIO DE FREITAS MELRO,"AVENIDA WANDERLEY, 396, EM FRENTE AO SEMEP","AVENIDA WANDERLEY, 396, EM FRENTE AO SEMEP, Penedo, Alagoas, Brasil",62,1.0,MATCH_FORTE,NAO_ENCONTRADO,,,,PENDENTE,,
PRIORIDADE_3,PRIORIDADE_3,ENDERECO_URBANO,PENEDO,UNIDADE DE ENSINO DE PENEDO/UFAL,UNIDADE DE ENSINO DE PENEDO/UFAL,"AVENIDA BEIRA RIO, S/N, UFAL, PX. A DELEGACIA DE POLICIA","AVENIDA BEIRA RIO, S/N, UFAL, PX. À DELEGACIA DE POLÍCIA, Penedo, Alagoas, Brasil",58,1.0,MATCH_FORTE,NAO_ENCONTRADO,,,,PENDENTE,,
PRIORIDADE_3,PRIORIDADE_3,ESCOLA_URBANA_OU_SEDE,DELMIRO GOUVEIA,"ERENICE GOMES DE LIMA, ESCOLA ESTADUAL PROFª","ERENICE GOMES DE LIMA, ESCOLA ESTADUAL PROFa",RUA MARTINHA CARDEAL S/N,"RUA MARTINHA CARDEAL S/N, Delmiro Gouveia, Alagoas, Brasil",55,0.9333,MATCH_PROVAVEL,NAO_ENCONTRADO,,,,PENDENTE,,
PRIORIDADE_3,PRIORIDADE_3,POVOADO,DELMIRO GOUVEIA,"MANOEL MOURA, COLEGIO DE 1 GRAU","MANOEL MOURA, COLEGIO DE 1 GRAU",POVOADO BARRAGEM,"POVOADO BARRAGEM, Delmiro Gouveia, Alagoas, Brasil",52,1.0,MATCH_FORTE,NAO_ENCONTRADO,,,,PENDENTE,,
PRIORIDADE_3,PRIORIDADE_3,POVOADO,PALMEIRA DOS INDIOS,ESCOLA ESTADUAL DIJANIRA SANTOS SILVA,ESCOLA ESTADUAL DIJANIRA SANTOS SILVA,POVOADO SANTO ANTONIO,"POVOADO SANTO ANTÔNIO, Palmeira Dos Indios, Alagoas, Brasil",52,1.0,MATCH_FORTE,NAO_ENCONTRADO,,,,PENDENTE,,
PRIORIDADE_3,PRIORIDADE_3,POVOADO,DELMIRO GOUVEIA,"JOSE CORREIA DOS SANTOS,GRUPO ESCOLAR","JOSE CORREIA DOS SANTOS,GRUPO ESCOLAR",POVOADO SINIMBU,"POVOADO SINIMBU, Delmiro Gouveia, Alagoas, Brasil",51,1.0,MATCH_FORTE,NAO_ENCONTRADO,,,,PENDENTE,,
PRIORIDADE_3,PRIORIDADE_3,POVOADO,PENEDO,EMEB HANNA BERTHOLET,EMEB HANNA BERTHOLET,POVOADO SANTA MARGARIDA,"POVOADO SANTA MARGARIDA, Penedo, Alagoas, Brasil",50,1.0,MATCH_FORTE,NAO_ENCONTRADO,,,,PENDENTE,,
PRIORIDADE_4,PRIORIDADE_4,ESCOLA_URBANA_OU_SEDE,MARECHAL DEODORO,ESCOLA MUNICIPAL ADELINA DE CARVALHO MELO,ESCOLA MUNICIPAL ADELINA DE CARVALHO MELO,RUA ADELINA DE CARVALHO MELO SN,"RUA ADELINA DE CARVALHO MELO SN, Marechal Deodoro, Alagoas, Brasil",47,1.0,MATCH_FORTE,NAO_ENCONTRADO,,,,PENDENTE,,
PRIORIDADE_4,PRIORIDADE_4,ENDERECO_URBANO,MARECHAL DEODORO,UBS - MARIA DO CARMO ARAÚJO SOARES,UBS - MARIA DO CARMO ARAUJO SOARES,"RUA ADELINA DE CARVALHO MELO, S/N","RUA ADELINA DE CARVALHO MELO, S/N, Marechal Deodoro, Alagoas, Brasil",45,1.0,MATCH_FORTE,NAO_ENCONTRADO,,,,PENDENTE,,
PRIORIDADE_4,PRIORIDADE_4,POVOADO,DELMIRO GOUVEIA,"JOSE CORREIA FILHO,ESCOLA","JOSE CORREIA FILHO,ESCOLA",POVOADO JARDIM CORDEIRO,"POVOADO JARDIM CORDEIRO, Delmiro Gouveia, Alagoas, Brasil",39,1.0,MATCH_FORTE,NAO_ENCONTRADO,,,,PENDENTE,,
PRIORIDADE_4,PRIORIDADE_4,VILA,MACEIO,CRECHE AGENOR FERNANDES PONTES,CRECHE AGENOR FERNANDES PONTES,"VILA GOIABEIRA, 132","VILA GOIABEIRA, 132, Maceio, Alagoas, Brasil",39,1.0,MATCH_FORTE,NAO_ENCONTRADO,,,,PENDENTE,,
PRIORIDADE_4,PRIORIDADE_4,ESCOLA_URBANA_OU_SEDE,PENEDO,ESCOLA ESTADUAL CLEMENTINO DO MONTE,ESCOLA ESTADUAL CLEMENTINO DO MONTE,"PRACA CLEMENTINO DO MONTE, S/N (EM FRENTE AO PENEDENSE)","PRAÇA CLEMENTINO DO MONTE, S/N (EM FRENTE AO PENEDENSE), Penedo, Alagoas, Brasil",35,1.0,MATCH_FORTE,NAO_ENCONTRADO,,,,PENDENTE,,
PRIORIDADE_4,PRIORIDADE_4,POVOADO,PALMEIRA DOS INDIOS,ESCOLA MUNICIPAL NOÉ SIMPLÍCIO,ESCOLA MUNICIPAL NOE SIMPLICIO,POVOADO BONIFACIO,"POVOADO BONIFÁCIO, Palmeira Dos Indios, Alagoas, Brasil",34,1.0,MATCH_FORTE,NAO_ENCONTRADO,,,,PENDENTE,,
PRIORIDADE_4,PRIORIDADE_4,POVOADO,PALMEIRA DOS INDIOS,ESCOLA ESTADUAL EGÍDIO BARBOSA,ESCOLA ESTADUAL EGIDIO BARBOSA,POVOADO LAGOA DO CALDEIRAO,"POVOADO LAGOA DO CALDEIRÃO, Palmeira Dos Indios, Alagoas, Brasil",32,1.0,MATCH_FORTE,NAO_ENCONTRADO,,,,PENDENTE,,
PRIORIDADE_4,PRIORIDADE_4,POVOADO,PALMEIRA DOS INDIOS,ESCOLA MUNICIPAL PEDRO RODRIGUES GAIA,ESCOLA MUNICIPAL PEDRO RODRIGUES GAIA,POVOADO CORURIPE DA CAL,"POVOADO CORURIPE DA CAL, Palmeira Dos Indios, Alagoas, Brasil",31,1.0,MATCH_FORTE,NAO_ENCONTRADO,,,,PENDENTE,,
PRIORIDADE_4,PRIORIDADE_4,POVOADO,DELMIRO GOUVEIA,"RAIMYSON SILVA NASCIMENTO, EMEF","RAIMYSON SILVA NASCIMENTO, EMEF",POVOADO CARAIBEIRINHAS,"POVOADO CARAIBEIRINHAS, Delmiro Gouveia, Alagoas, Brasil",30,1.0,MATCH_FORTE,NAO_ENCONTRADO,,,,PENDENTE,,
PRIORIDADE_4,PRIORIDADE_4,POVOADO,DELMIRO GOUVEIA,"SAO JOSE, ESCOLA MUN DE ENSINO FUNDAMENTAL","SAO JOSE, ESCOLA MUN DE ENSINO FUNDAMENTAL",POVOADO SALGADO,"POVOADO SALGADO, Delmiro Gouveia, Alagoas, Brasil",29,1.0,MATCH_FORTE,NAO_ENCONTRADO,,,,PENDENTE,,
PRIORIDADE_4,PRIORIDADE_4,POVOADO,PENEDO,EMEB SANTO ANTÔNIO,EMEB SANTO ANTONIO,POVOADO TABULEIRO DOS NEGROS,"POVOADO TABULEIRO DOS NEGROS, Penedo, Alagoas, Brasil",28,1.0,MATCH_FORTE,NAO_ENCONTRADO,,,,PENDENTE,,
PRIORIDADE_4,PRIORIDADE_4,OUTROS,PALMEIRA DOS INDIOS,UNIVERSISADE ESTADUAL DE ALAGOAS - UNEAL - PALMERIA DOS ÍNDIOS,UNIVERSISADE ESTADUAL DE ALAGOAS - UNEAL - PALMERIA DOS INDIOS,"RODOVIA EDUARDO ALVES DA SILVA, KM 03","RODOVIA EDUARDO ALVES DA SILVA, KM 03, Palmeira Dos Indios, Alagoas, Brasil",26,1.0,MATCH_FORTE,NAO_ENCONTRADO,,,,PENDENTE,,
PRIORIDADE_4,PRIORIDADE_4,POVOADO,DELMIRO GOUVEIA,"ANTENOR CORREIA SERPA, ESCOLA MUNICIPAL DR.","ANTENOR CORREIA SERPA, ESCOLA MUNICIPAL DR.",POVOADO CRUZ,"POVOADO CRUZ, Delmiro Gouveia, Alagoas, Brasil",25,1.0,MATCH_FORTE,NAO_ENCONTRADO,,,,PENDENTE,,
PRIORIDADE_4,PRIORIDADE_4,POVOADO,PENEDO,EMEB PROFª MARIA DA GLÓRIA PIMENTEIRA,EMEB PROFa MARIA DA GLORIA PIMENTEIRA,POVOADO PONTA MOFINA,"POVOADO PONTA MOFINA, Penedo, Alagoas, Brasil",24,0.9231,MATCH_PROVAVEL,NAO_ENCONTRADO,,,,PENDENTE,,
PRIORIDADE_4,PRIORIDADE_4,POVOADO,DELMIRO GOUVEIA,ESCOLA MUNICIPAL DE EDUCAÇÃO BÁSICA JUSCELINO KUBISTCHEK DE OLIVEIRA,ESCOLA MUNICIPAL DE EDUCACAO BASICA JUSCELINO KUBISTCHEK DE OLIVEIRA,POVOADO ALTO BONITO,"POVOADO ALTO BONITO, Delmiro Gouveia, Alagoas, Brasil",23,1.0,MATCH_FORTE,NAO_ENCONTRADO,,,,PENDENTE,,
PRIORIDADE_4,PRIORIDADE_4,POVOADO,PENEDO,EMEB PROFESSOR IRÊNIO ARAÚJO,EMEB PROFESSOR IRENIO ARAUJO,POVOADO MARITUBA DO PEIXE,"POVOADO MARITUBA DO PEIXE, Penedo, Alagoas, Brasil",17,1.0,MATCH_FORTE,NAO_ENCONTRADO,,,,PENDENTE,,
