prioridade,prioridade_recalculada,tipo_pendencia,municipio,local_sem_geo,melhor_local_cache,endereco_cache,consulta_geocoding,registros_afetados,score_similaridade,status_match,status_geocodificacao,latitude_curadoria,longitude_curadoria,bairro_curadoria,status_curadoria,fonte_validacao,observacao_curadoria
PRIORIDADE_1,PRIORIDADE_1,CONJUNTO_HABITACIONAL,MACEIO,ESCOLA DE ENSINO FUNDAMENTAL DR JOSE HAROLDO DA COSTA,ESCOLA DE ENSINO FUNDAMENTAL DR JOSE HAROLDO DA COSTA,"CONJ. SALVADOR LIRA, S/N","CONJ. SALVADOR LIRA, S/N, Maceio, Alagoas, Brasil",594,1.0,MATCH_FORTE,NAO_ENCONTRADO,,,,PENDENTE,,
PRIORIDADE_1,PRIORIDADE_1,ESCOLA_URBANA_OU_SEDE,MACEIO,ESCOLA DE ENS. FUND. NOSSO LAR I,ESCOLA DE ENS. FUND. NOSSO LAR I,"RUA SAMPAIO DORIA, S/N","RUA SAMPAIO DORIA, S/N, Maceio, Alagoas, Brasil",467,1.0,MATCH_FORTE,NAO_ENCONTRADO,,,,PENDENTE,,
PRIORIDADE_1,PRIORIDADE_1,ESCOLA_URBANA_OU_SEDE,PENEDO,COLÉGIO ESTADUAL COMENDADOR JOSÉ DA SILVA PEIXOTO,COLEGIO ESTADUAL COMENDADOR JOSE DA SILVA PEIXOTO,"RUA CASTRO ALVES, S/N, EM FRENTE A CODEVASF","RUA CASTRO ALVES, S/N, EM FRENTE À CODEVASF, Penedo, Alagoas, Brasil",431,1.0,MATCH_FORTE,NAO_ENCONTRADO,,,,PENDENTE,,
PRIORIDADE_1,PRIORIDADE_1,ESCOLA_URBANA_OU_SEDE,UNIAO DOS PALMARES,ESCOLA ESTADUAL CARLOS GOMES DE BARROS,ESCOLA ESTADUAL CARLOS GOMES DE BARROS,"AV. JOAO LYRA FILHO, S/N","AV. JOÃO LYRA FILHO, S/N, Uniao Dos Palmares, Alagoas, Brasil",426,1.0,MATCH_FORTE,NAO_ENCONTRADO,,,,PENDENTE,,
PRIORIDADE_1,PRIORIDADE_1,ESCOLA_URBANA_OU_SEDE,ARAPIRACA,ESCOLA DE ENSINO FUNDAMENTAL CLAUDECY BISPO DOS SANTOS,ESCOLA DE ENSINO FUNDAMENTAL CLAUDECY BISPO DOS SANTOS,RUA JOSE C. DE FARIAS,"RUA JOSÉ C. DE FARIAS, Arapiraca, Alagoas, Brasil",399,1.0,MATCH_FORTE,NAO_ENCONTRADO,,,,PENDENTE,,
PRIORIDADE_1,PRIORIDADE_1,ESCOLA_URBANA_OU_SEDE,ARAPIRACA,ESCOLA DE 1 GRAU MANOEL ANDRÉ,ESCOLA DE 1 GRAU MANOEL ANDRE,AV. JOSE LUCIO DA SILVA S/N,"AV. JOSE LÚCIO DA SILVA S/N, Arapiraca, Alagoas, Brasil",395,1.0,MATCH_FORTE,NAO_ENCONTRADO,,,,PENDENTE,,
PRIORIDADE_1,PRIORIDADE_1,SITIO,MACEIO,ESC. EST. MIRAN MARROQUIM,ESC. EST. MIRAN MARROQUIM,"RUA DA LIBERDADE, S/N - PIABAS","RUA DA LIBERDADE, S/N - PIABAS, Maceio, Alagoas, Brasil",381,1.0,MATCH_FORTE,NAO_ENCONTRADO,,,,PENDENTE,,
PRIORIDADE_1,PRIORIDADE_1,ESCOLA_URBANA_OU_SEDE,MACEIO,E.M. JAYME DE ALTAVILLA,E.M. JAYME DE ALTAVILLA,"RUA DILERMANO REIS, S/N, LOT SANTA LUCIA","RUA DILERMANO REIS, S/N, LOT SANTA LUCIA, Maceio, Alagoas, Brasil",359,1.0,MATCH_FORTE,NAO_ENCONTRADO,,,,PENDENTE,,
PRIORIDADE_1,PRIORIDADE_1,ESCOLA_URBANA_OU_SEDE,ARAPIRACA,ESCOLA DE 1 GRAU PARQUE LIONS,ESCOLA DE 1 GRAU PARQUE LIONS,RUA GOV. AFRANIO LAGES S/N,"RUA GOV. AFRÂNIO LAGES S/N, Arapiraca, Alagoas, Brasil",357,1.0,MATCH_FORTE,NAO_ENCONTRADO,,,,PENDENTE,,
PRIORIDADE_1,PRIORIDADE_1,ESCOLA_URBANA_OU_SEDE,MACEIO,ESCOLA ESTADUAL PROFª. MARIA SALETE GUSMAO DE ARAUJO,ESCOLA ESTADUAL PROFa. MARIA SALETE GUSMAO DE ARAUJO,"CJ. OSMAN LOUREIRO, QD A","CJ. OSMAN LOUREIRO, QD A, Maceio, Alagoas, Brasil",353,0.9434,MATCH_PROVAVEL,NAO_ENCONTRADO,,,,PENDENTE,,
PRIORIDADE_1,PRIORIDADE_1,POVOADO,ARAPIRACA,ESCOLA DE 1 GRAU FERNANDO COLLOR DE MELLO,ESCOLA DE 1 GRAU FERNANDO COLLOR DE MELLO,POVOADO CANAA S/N,"POVOADO CANAÃ S/N, Arapiraca, Alagoas, Brasil",329,1.0,MATCH_FORTE,NAO_ENCONTRADO,,,,PENDENTE,,
PRIORIDADE_1,PRIORIDADE_1,POVOADO,ARAPIRACA,ESCOLA DE ENSINO FUNDAMENTAL ENÉAS BENEDITO DOS SANTOS,ESCOLA DE ENSINO FUNDAMENTAL ENEAS BENEDITO DOS SANTOS,POVOADO CANGANDU S/N,"POVOADO CANGANDU S/N, Arapiraca, Alagoas, Brasil",323,1.0,MATCH_FORTE,NAO_ENCONTRADO,,,,PENDENTE,,
PRIORIDADE_1,PRIORIDADE_1,SITIO,MACEIO,ESC. EST. PROF. THEOTÔNIO VILELA BRANDÃO,ESC. EST. PROF. THEOTONIO VILELA BRANDAO,"RUA ADAUTO GOMES BARBOSA, SN - SANTO EDUARDO","RUA ADAUTO GOMES BARBOSA, SN - SANTO EDUARDO, Maceio, Alagoas, Brasil",319,1.0,MATCH_FORTE,NAO_ENCONTRADO,,,,PENDENTE,,
PRIORIDADE_1,PRIORIDADE_1,LOTEAMENTO,MACEIO,COLÉGIO EDSON MONTEIRO,COLEGIO EDSON MONTEIRO,"RUA ANDRE PAPINE GOES, 177, LOTEAMENTO ACAUA","RUA ANDRÉ PAPINE GOES, 177, LOTEAMENTO ACAUÃ, Maceio, Alagoas, Brasil",308,1.0,MATCH_FORTE,NAO_ENCONTRADO,,,,PENDENTE,,
PRIORIDADE_1,PRIORIDADE_1,CONJUNTO_HABITACIONAL,ARAPIRACA,ESCOLA DE ENSINO FUNDAMENTAL CLEONICE BARBOSA DE ALMEIDA,ESCOLA DE ENSINO FUNDAMENTAL CLEONICE BARBOSA DE ALMEIDA,CONJUNTO BRISA DO LAGO - OLHO DAGUA DOS CAZUZINHO,"CONJUNTO BRISA DO LAGO - OLHO DAGUA DOS CAZUZINHO, Arapiraca, Alagoas, Brasil",301,1.0,MATCH_FORTE,NAO_ENCONTRADO,,,,PENDENTE,,
PRIORIDADE_2,PRIORIDADE_2,CONJUNTO_HABITACIONAL,MACEIO,COLÉGIO ZUMBI DOS PALMARES,COLEGIO ZUMBI DOS PALMARES,"CJ ROSANE COLLOR, QD M, S/N","CJ ROSANE COLLOR, QD M, S/N, Maceio, Alagoas, Brasil",299,1.0,MATCH_FORTE,NAO_ENCONTRADO,,,,PENDENTE,,
PRIORIDADE_2,PRIORIDADE_2,ESCOLA_URBANA_OU_SEDE,MACEIO,ESC. MUN. PROF. LENILTO ALVES SANTOS,ESC. MUN. PROF. LENILTO ALVES SANTOS,"RUA ENFERMEIRO MARIANO - COHAB, S/N","RUA ENFERMEIRO MARIANO - COHAB, S/N, Maceio, Alagoas, Brasil",289,1.0,MATCH_FORTE,NAO_ENCONTRADO,,,,PENDENTE,,
PRIORIDADE_2,PRIORIDADE_2,ESCOLA_URBANA_OU_SEDE,RIO LARGO,ESCOLA DE ENSINO FUND DR GASTAO OITICICA,ESCOLA DE ENSINO FUND DR GASTAO OITICICA,AV JULIO CALHEIROS S/N,"AV JULIO CALHEIROS S/N, Rio Largo, Alagoas, Brasil",282,1.0,MATCH_FORTE,NAO_ENCONTRADO,,,,PENDENTE,,
PRIORIDADE_2,PRIORIDADE_2,ESCOLA_URBANA_OU_SEDE,ARAPIRACA,ESCOLA DE ENSINO FUNDAMENTAL LOJA MAÇONICA,ESCOLA DE ENSINO FUNDAMENTAL LOJA MACONICA,RUA JOSE CLOVIS R. DE BARROS,"RUA JOSÉ CLOVIS R. DE BARROS, Arapiraca, Alagoas, Brasil",281,1.0,MATCH_FORTE,NAO_ENCONTRADO,,,,PENDENTE,,
PRIORIDADE_2,PRIORIDADE_2,CONJUNTO_HABITACIONAL,MACEIO,ESC. MUN. ARNON AFFONSO FARIAS DE MELLO,ESC. MUN. ARNON AFFONSO FARIAS DE MELLO,"CONJ. JOSE DA SILVA PEIXOTO, S/N","CONJ. JOSE DA SILVA PEIXOTO, S/N, Maceio, Alagoas, Brasil",275,1.0,MATCH_FORTE,NAO_ENCONTRADO,,,,PENDENTE,,
PRIORIDADE_2,PRIORIDADE_2,SITIO,MACEIO,ESC. EST. PROF. EDUARDO DA MOTA TRIGUEIROS,ESC. EST. PROF. EDUARDO DA MOTA TRIGUEIROS,"RUA ADAUTO GOMES BARBOSA, S/N - SANTO EDUARDO","RUA ADAUTO GOMES BARBOSA, S/N - SANTO EDUARDO, Maceio, Alagoas, Brasil",270,1.0,MATCH_FORTE,NAO_ENCONTRADO,,,,PENDENTE,,
PRIORIDADE_2,PRIORIDADE_2,ESCOLA_URBANA_OU_SEDE,UNIAO DOS PALMARES,ESCOLA MUNICIPAL JOÃO COSTA DE OLIVEIRA,ESCOLA MUNICIPAL JOAO COSTA DE OLIVEIRA,"QUADRA P1, S/N","QUADRA P1, S/N, Uniao Dos Palmares, Alagoas, Brasil",267,1.0,MATCH_FORTE,NAO_ENCONTRADO,,,,PENDENTE,,
PRIORIDADE_2,PRIORIDADE_2,POVOADO,ARAPIRACA,ESCOLA PROFESSOR LUIZ ALBERTO DE MELO,ESCOLA PROFESSOR LUIZ ALBERTO DE MELO,POVOADO PAU D ARCO S/N,"POVOADO PAU D ARCO S/N, Arapiraca, Alagoas, Brasil",264,1.0,MATCH_FORTE,NAO_ENCONTRADO,,,,PENDENTE,,
PRIORIDADE_2,PRIORIDADE_2,ESCOLA_URBANA_OU_SEDE,MACEIO,E.E. JORNALISTA LAFAIETTE BELO,E.E. JORNALISTA LAFAIETTE BELO,"PARQUE RESIDENCIAL BENEDITO BENTES I, S/N","PARQUE RESIDENCIAL BENEDITO BENTES I, S/N, Maceio, Alagoas, Brasil",259,1.0,MATCH_FORTE,NAO_ENCONTRADO,,,,PENDENTE,,
PRIORIDADE_2,PRIORIDADE_2,ESCOLA_URBANA_OU_SEDE,MACEIO,ESC. MUN. PROFª EULINA RIBEIRO ALENCAR,ESC. MUN. PROFa EULINA RIBEIRO ALENCAR,"RUA COARACI FONSECA, 01","RUA COARACI FONSECA, 01, Maceio, Alagoas, Brasil",259,0.9362,MATCH_PROVAVEL,NAO_ENCONTRADO,,,,PENDENTE,,
PRIORIDADE_2,PRIORIDADE_2,ESCOLA_URBANA_OU_SEDE,MACEIO,ESCOLA ESTADUAL PROFESSOR PEDRO TEIXEIRA,ESCOLA ESTADUAL PROFESSOR PEDRO TEIXEIRA,"RUA PAU DARCO, S/N","RUA PAU DARCO, S/N, Maceio, Alagoas, Brasil",259,1.0,MATCH_FORTE,NAO_ENCONTRADO,,,,PENDENTE,,
PRIORIDADE_2,PRIORIDADE_2,POVOADO,ARAPIRACA,GRUPO ESCOLAR JOSE PEREIRA LÚCIO,GRUPO ESCOLAR JOSE PEREIRA LUCIO,POVOADO BANANEIRAS S/N,"POVOADO BANANEIRAS S/N, Arapiraca, Alagoas, Brasil",252,1.0,MATCH_FORTE,NAO_ENCONTRADO,,,,PENDENTE,,
PRIORIDADE_2,PRIORIDADE_2,ESCOLA_URBANA_OU_SEDE,CORURIPE,ESCOLA ESTADUAL DJALMA BARROS SIQUEIRA,ESCOLA ESTADUAL DJALMA BARROS SIQUEIRA,"RUA PERNAMBUCO NOVO, S/N","RUA PERNAMBUCO NOVO, S/N, Coruripe, Alagoas, Brasil",249,1.0,MATCH_FORTE,NAO_ENCONTRADO,,,,PENDENTE,,
PRIORIDADE_2,PRIORIDADE_2,ESCOLA_URBANA_OU_SEDE,MACEIO,ESC. MUN. ANTÔNIO SEMEÃO LAMENHA LINS,ESC. MUN. ANTONIO SEMEAO LAMENHA LINS,"RUA MAJOR JOAQUIM CALHEIROS, S/N","RUA MAJOR JOAQUIM CALHEIROS, S/N, Maceio, Alagoas, Brasil",247,1.0,MATCH_FORTE,NAO_ENCONTRADO,,,,PENDENTE,,
PRIORIDADE_2,PRIORIDADE_2,CONJUNTO_HABITACIONAL,MACEIO,E.M. PROF. AURÉLIO BUARQUE DE HOLANDA FERREIRA,E.M. PROF. AURELIO BUARQUE DE HOLANDA FERREIRA,"RUA F, S/N, CONJUNTO FREITAS NETO","RUA F, S/N, CONJUNTO FREITAS NETO, Maceio, Alagoas, Brasil",246,1.0,MATCH_FORTE,NAO_ENCONTRADO,,,,PENDENTE,,
PRIORIDADE_2,PRIORIDADE_2,SITIO,MACEIO,ESC. EST. MANOEL SIMPLICIO DO NASCIMENTO,ESC. EST. MANOEL SIMPLICIO DO NASCIMENTO,"RUA DIVISORIA FEICAO, S/N","RUA DIVISORIA FEICAO, S/N, Maceio, Alagoas, Brasil",244,1.0,MATCH_FORTE,NAO_ENCONTRADO,,,,PENDENTE,,
PRIORIDADE_2,PRIORIDADE_2,ESCOLA_URBANA_OU_SEDE,RIO LARGO,ESCOLA DE EDUCAÇÃO BÁSICA AGNUS DEI,ESCOLA DE EDUCACAO BASICA AGNUS DEI,"AV. PRESIDENTE FERNANDO A. COLLO DE MELO,96, ANTONIO LINS DE SOUZA","AV. PRESIDENTE FERNANDO A. COLLO DE MELO,96, ANTONIO LINS DE SOUZA, Rio Largo, Alagoas, Brasil",243,1.0,MATCH_FORTE,NAO_ENCONTRADO,,,,PENDENTE,,
PRIORIDADE_2,PRIORIDADE_2,ESCOLA_URBANA_OU_SEDE,MACEIO,E.M. MARIA CARMELITA CARDOSO GAMA (CAIC-UFAL),E.M. MARIA CARMELITA CARDOSO GAMA (CAIC-UFAL),"BR 104, 1099 KM 14 - CAMPUS A.C.SIMOES","BR 104, 1099 KM 14 - CAMPUS A.C.SIMOES, Maceio, Alagoas, Brasil",241,1.0,MATCH_FORTE,NAO_ENCONTRADO,,,,PENDENTE,,
PRIORIDADE_2,PRIORIDADE_2,CONJUNTO_HABITACIONAL,RIO LARGO,ESCOLA MUNICIPAL TERESA CRISTINA LINS DE SOUZA COSTA,ESCOLA MUNICIPAL TERESA CRISTINA LINS DE SOUZA COSTA,"CJ RES. FRANCISCO TAVARES GRANJA, S/N","CJ RES. FRANCISCO TAVARES GRANJA, S/N, Rio Largo, Alagoas, Brasil",240,1.0,MATCH_FORTE,NAO_ENCONTRADO,,,,PENDENTE,,
PRIORIDADE_2,PRIORIDADE_2,ESCOLA_URBANA_OU_SEDE,MACEIO,ESC. MUN. DR. BALTAZAR DE MENDONÇA,ESC. MUN. DR. BALTAZAR DE MENDONCA,"RUA DIVISORIA FEICAO, S/N","RUA DIVISORIA FEICAO, S/N, Maceio, Alagoas, Brasil",239,1.0,MATCH_FORTE,NAO_ENCONTRADO,,,,PENDENTE,,
PRIORIDADE_2,PRIORIDADE_2,VILA,PENEDO,ESCOLA MUNICIPAL VEREADOR MANOEL SOARES DE MELO,ESCOLA MUNICIPAL VEREADOR MANOEL SOARES DE MELO,"RUA FLORIANO ROSA, S/N, PX. AO POSTO DE SAUDE, CONJUNTO VILA MATIAS","RUA FLORIANO ROSA, S/N, PX. AO POSTO DE SAÚDE, CONJUNTO VILA MATIAS, Penedo, Alagoas, Brasil",236,1.0,MATCH_FORTE,NAO_ENCONTRADO,,,,PENDENTE,,
PRIORIDADE_2,PRIORIDADE_2,CONJUNTO_HABITACIONAL,RIO LARGO,ESCOLA MUNICIPAL DE EDUCAÇÃO BASICA INDUSTRIAL LUIGI BAUDUCCO,ESCOLA MUNICIPAL DE EDUCACAO BASICA INDUSTRIAL LUIGI BAUDUCCO,"AVENIDA PASTOR JOSUE LINS CONJUNTO CRUZEIRO DO SUL, C RESIDENCIAL","AVENIDA PASTOR JOSUE LINS CONJUNTO CRUZEIRO DO SUL, C RESIDENCIAL, Rio Largo, Alagoas, Brasil",236,1.0,MATCH_FORTE,NAO_ENCONTRADO,,,,PENDENTE,,
PRIORIDADE_2,PRIORIDADE_2,ESCOLA_URBANA_OU_SEDE,SAO MIGUEL DOS CAMPOS,ESCOLA MUNICIPAL PROFESSORA INEIDE NOGUEIRA ROCHA,ESCOLA MUNICIPAL PROFESSORA INEIDE NOGUEIRA ROCHA,"RUA ALICIA VITORIA URBANO DE OLIVEIRA LOPES, QUADRA O1, S/N","RUA ALÍCIA VITÓRIA URBANO DE OLIVEIRA LOPES, QUADRA O1, S/N, Sao Miguel Dos Campos, Alagoas, Brasil",231,1.0,MATCH_FORTE,NAO_ENCONTRADO,,,,PENDENTE,,
PRIORIDADE_2,PRIORIDADE_2,ESCOLA_URBANA_OU_SEDE,RIO LARGO,ESCOLA DE ENSINO FUNDAMENTAL MARIETA LEÃO,ESCOLA DE ENSINO FUNDAMENTAL MARIETA LEAO,PATIO DA REDE FERROVIARIA S/N,"PATIO DA REDE FERROVIARIA S/N, Rio Largo, Alagoas, Brasil",229,1.0,MATCH_FORTE,NAO_ENCONTRADO,,,,PENDENTE,,
PRIORIDADE_2,PRIORIDADE_2,ESCOLA_URBANA_OU_SEDE,PENEDO,ESCOLA ESTADUAL PROFESSOR ERNANI MÉRO (GRUPO ESCOLAR EXPERIMENTAL),ESCOLA ESTADUAL PROFESSOR ERNANI MERO (GRUPO ESCOLAR EXPERIMENTAL),"PRACA LARGO DE FATIMA, S/N, EM FRENTE AO NUDEPE","PRAÇA LARGO DE FÁTIMA, S/N, EM FRENTE AO NUDEPE, Penedo, Alagoas, Brasil",227,1.0,MATCH_FORTE,NAO_ENCONTRADO,,,,PENDENTE,,
PRIORIDADE_2,PRIORIDADE_2,ESCOLA_URBANA_OU_SEDE,MACEIO,ESC. MUN. DR. ORLANDO ARAÚJO,ESC. MUN. DR. ORLANDO ARAUJO,"RUA DR. JOSE SAMPAIO LUZ, S/N","RUA DR. JOSE SAMPAIO LUZ, S/N, Maceio, Alagoas, Brasil",226,1.0,MATCH_FORTE,NAO_ENCONTRADO,,,,PENDENTE,,
PRIORIDADE_2,PRIORIDADE_2,VILA,RIO LARGO,GRUPO ESCOLAR MANOEL SOARES DE SOUZA,GRUPO ESCOLAR MANOEL SOARES DE SOUZA,VILA RAUL S/N,"VILA RAUL S/N, Rio Largo, Alagoas, Brasil",218,1.0,MATCH_FORTE,NAO_ENCONTRADO,,,,PENDENTE,,
PRIORIDADE_2,PRIORIDADE_2,VILA,ARAPIRACA,GRUPO ESCOLAR ANTÔNIO CEZÁRIO DE OLIVEIRA,GRUPO ESCOLAR ANTONIO CEZARIO DE OLIVEIRA,VILA SAO JOSE S/N,"VILA SAÕ JOSÉ S/N, Arapiraca, Alagoas, Brasil",212,1.0,MATCH_FORTE,NAO_ENCONTRADO,,,,PENDENTE,,
PRIORIDADE_2,PRIORIDADE_2,OUTROS,MACEIO,CENTRO DE ENSINO SANTA JULIANA,CENTRO DE ENSINO SANTA JULIANA,"AV DURVAL DE GOES MONTEIRO, 2345, C67P, CM","AV DURVAL DE GOES MONTEIRO, 2345, C67P, CM, Maceio, Alagoas, Brasil",212,1.0,MATCH_FORTE,NAO_ENCONTRADO,,,,PENDENTE,,
PRIORIDADE_2,PRIORIDADE_2,ESCOLA_URBANA_OU_SEDE,MACEIO,ESC. MUN. RADIALISTA EDÉCIO LOPES (ANTIGO COL. LAERSON ROSA),ESC. MUN. RADIALISTA EDECIO LOPES (ANTIGO COL. LAERSON ROSA),"RUA ALAMEDA CELIA DOS ANJOS, 06","RUA ALAMEDA CÉLIA DOS ANJOS, 06, Maceio, Alagoas, Brasil",212,1.0,MATCH_FORTE,NAO_ENCONTRADO,,,,PENDENTE,,
PRIORIDADE_2,PRIORIDADE_2,ESCOLA_URBANA_OU_SEDE,RIO LARGO,ESCOLA MUNICIPAL DE ENSINO F. PROFESSOR JOSÉ EDMILSON,ESCOLA MUNICIPAL DE ENSINO F. PROFESSOR JOSE EDMILSON,"COJ NAPOLEAO VIANA,S/N, BAR NOSSO, PREF ANTONIO LINS DE SOUZA","COJ NAPOLEÃO VIANA,S/N, BAR NOSSO, PREF ANTONIO LINS DE SOUZA, Rio Largo, Alagoas, Brasil",211,1.0,MATCH_FORTE,NAO_ENCONTRADO,,,,PENDENTE,,
PRIORIDADE_2,PRIORIDADE_2,ESCOLA_URBANA_OU_SEDE,MACEIO,ESCOLA MUN. SÉRGIO LUIZ PESSOA BRAGA,ESCOLA MUN. SERGIO LUIZ PESSOA BRAGA,"PRACA GOVERNADOR LAMENHA FILHO, S/N","PRACA GOVERNADOR LAMENHA FILHO, S/N, Maceio, Alagoas, Brasil",205,1.0,MATCH_FORTE,NAO_ENCONTRADO,,,,PENDENTE,,
PRIORIDADE_2,PRIORIDADE_2,ESCOLA_URBANA_OU_SEDE,MACEIO,COLÉGIO SAGRADA FAMILIA,COLEGIO SAGRADA FAMILIA,"RUA ALAMEDA MARIA DAS GRACAS NOVAES BRANDAO VILELA, 07","RUA ALAMEDA MARIA DAS GRAÇAS NOVAES BRANDÃO VILELA, 07, Maceio, Alagoas, Brasil",203,1.0,MATCH_FORTE,NAO_ENCONTRADO,,,,PENDENTE,,
PRIORIDADE_2,PRIORIDADE_2,ESCOLA_URBANA_OU_SEDE,CORURIPE,ESCOLA MUN. EDUC. BÁSICA PROF. MARIA ROCHA SANTOS SILVA,ESCOLA MUN. EDUC. BASICA PROF. MARIA ROCHA SANTOS SILVA,"TRAVESSA FLAMENGO, 182, QUADRA S","TRAVESSA FLAMENGO, 182, QUADRA S, Coruripe, Alagoas, Brasil",198,1.0,MATCH_FORTE,NAO_ENCONTRADO,,,,PENDENTE,,
PRIORIDADE_2,PRIORIDADE_2,POVOADO,ARAPIRACA,ESCOLA LINDAUVA EULÁLIA DE FARIAS,ESCOLA LINDAUVA EULALIA DE FARIAS,POVOADO BAIXA GRANDE DE DENTRO,"POVOADO BAIXA GRANDE DE DENTRO, Arapiraca, Alagoas, Brasil",197,1.0,MATCH_FORTE,NAO_ENCONTRADO,,,,PENDENTE,,
PRIORIDADE_2,PRIORIDADE_2,ESCOLA_URBANA_OU_SEDE,ARAPIRACA,ESCOLA DE ENSINO FUNDAMENTAL VOLUNTÁRIA MARIA DAS NEVES BORGES,ESCOLA DE ENSINO FUNDAMENTAL VOLUNTARIA MARIA DAS NEVES BORGES,"RUA SINESIO FERREIRA LIMA, N 383, OURO PRETO","RUA SINÉSIO FERREIRA LIMA, N 383, OURO PRETO, Arapiraca, Alagoas, Brasil",196,1.0,MATCH_FORTE,NAO_ENCONTRADO,,,,PENDENTE,,
PRIORIDADE_2,PRIORIDADE_2,ESCOLA_URBANA_OU_SEDE,MACEIO,ESC. DE ENS. FUND. PROF. ALMEIDA LEITE,ESC. DE ENS. FUND. PROF. ALMEIDA LEITE,"RUA DR. VIRGILIO GUEDES, S/N","RUA DR. VIRGILIO GUEDES, S/N, Maceio, Alagoas, Brasil",194,1.0,MATCH_FORTE,NAO_ENCONTRADO,,,,PENDENTE,,
PRIORIDADE_2,PRIORIDADE_2,ESCOLA_URBANA_OU_SEDE,MACEIO,ESCOLA MUNICIPAL PROFESSORA JAREDE VIANA DE OLIVEIRA,ESCOLA MUNICIPAL PROFESSORA JAREDE VIANA DE OLIVEIRA,"RUA SAO JOSE, S/N, AO LADO DA ESCOLA MUNICIPAL TOBIAS GRANJA","RUA SÃO JOSÉ, S/N, AO LADO DA ESCOLA MUNICIPAL TOBIAS GRANJA, Maceio, Alagoas, Brasil",194,1.0,MATCH_FORTE,NAO_ENCONTRADO,,,,PENDENTE,,
PRIORIDADE_2,PRIORIDADE_2,VILA,MACEIO,E.M. MARIA DE LOURDES DE MELO PIMENTEL,E.M. MARIA DE LOURDES DE MELO PIMENTEL,"RUA PADRE CICERO, 05, VILAGE CAMPESTE II","RUA PADRE CÍCERO, 05, VILAGE CAMPESTE II, Maceio, Alagoas, Brasil",189,1.0,MATCH_FORTE,NAO_ENCONTRADO,,,,PENDENTE,,
PRIORIDADE_2,PRIORIDADE_2,VILA,MACEIO,E.M. PROFA. HÉVIA VALÉRIA MAIA AMORIM,E.M. PROFA. HEVIA VALERIA MAIA AMORIM,"AV JOSE AILTON DOS SANTOS, S/N, VILAGE CAMPESTRE I","AV JOSÉ AILTON DOS SANTOS, S/N, VILAGE CAMPESTRE I, Maceio, Alagoas, Brasil",189,1.0,MATCH_FORTE,NAO_ENCONTRADO,,,,PENDENTE,,
PRIORIDADE_2,PRIORIDADE_2,ESCOLA_URBANA_OU_SEDE,CORURIPE,ESCOLA MUN. CENT. EDUCAÇÃO INFANTIL PROF. MARIA ZENAIDE ROCHA SANTOS,ESCOLA MUN. CENT. EDUCACAO INFANTIL PROF. MARIA ZENAIDE ROCHA SANTOS,"RUA PERNAMBUCO NOVO, S/N,","RUA PERNAMBUCO NOVO, S/N,, Coruripe, Alagoas, Brasil",188,1.0,MATCH_FORTE,NAO_ENCONTRADO,,,,PENDENTE,,
PRIORIDADE_2,PRIORIDADE_2,POVOADO,CORURIPE,ESCOLA MUNICIPAL SANTA SOFIA,ESCOLA MUNICIPAL SANTA SOFIA,RUA DA CAIXA DAGUA - POVOADO BOTAFOGO,"RUA DA CAIXA DAGUA - POVOADO BOTAFOGO, Coruripe, Alagoas, Brasil",188,1.0,MATCH_FORTE,NAO_ENCONTRADO,,,,PENDENTE,,
PRIORIDADE_2,PRIORIDADE_2,ESCOLA_URBANA_OU_SEDE,MACEIO,ESC. MUN. JOÃO XXIII,ESC. MUN. JOAO XXIII,"RUA DR.JOSE JOAQUIM DE ARAUJO, S/N","RUA DR.JOSE JOAQUIM DE ARAUJO, S/N, Maceio, Alagoas, Brasil",188,1.0,MATCH_FORTE,NAO_ENCONTRADO,,,,PENDENTE,,
PRIORIDADE_2,PRIORIDADE_2,ESCOLA_URBANA_OU_SEDE,RIO LARGO,ANTIGA ESCOLA FRANCISCO LEÃO DO CENTRO,ANTIGA ESCOLA FRANCISCO LEAO DO CENTRO,"PRACA TEIZEIRA BARROS., SN","PRAÇA TEIZEIRA BARROS., SN, Rio Largo, Alagoas, Brasil",187,1.0,MATCH_FORTE,NAO_ENCONTRADO,,,,PENDENTE,,
PRIORIDADE_2,PRIORIDADE_2,ESCOLA_URBANA_OU_SEDE,MACEIO,ESCOLA MUN. SILVESTRE PÉRICLES,ESCOLA MUN. SILVESTRE PERICLES,PRACA DR CAIO DE AGUIAR PORTO S/N - PONTAL DA BARRA,"PRAÇA DR CAIO DE AGUIAR PORTO S/N - PONTAL DA BARRA, Maceio, Alagoas, Brasil",184,1.0,MATCH_FORTE,NAO_ENCONTRADO,,,,PENDENTE,,
PRIORIDADE_2,PRIORIDADE_2,ESCOLA_URBANA_OU_SEDE,DELMIRO GOUVEIA,"VIRGILIA BEZERRA,ESCOLA DE 1 E 2 GRAUS PROFESSORA","VIRGILIA BEZERRA,ESCOLA DE 1 E 2 GRAUS PROFESSORA",AV MASCARENHAS DE MORAIS S/N,"AV MASCARENHAS DE MORAIS S/N, Delmiro Gouveia, Alagoas, Brasil",177,1.0,MATCH_FORTE,NAO_ENCONTRADO,,,,PENDENTE,,
PRIORIDADE_2,PRIORIDADE_2,ENDERECO_URBANO,PENEDO,COOPERATIVA EDUCACIONAL DE PENEDO - COOPEPE LTDA,COOPERATIVA EDUCACIONAL DE PENEDO - COOPEPE LTDA,"PARQUE DR. ADAIL FREIRE PEREIRA, 127 (PRACA SANTA LUZIA)","PARQUE DR. ADAIL FREIRE PEREIRA, 127 (PRAÇA SANTA LUZIA), Penedo, Alagoas, Brasil",175,1.0,MATCH_FORTE,NAO_ENCONTRADO,,,,PENDENTE,,
PRIORIDADE_2,PRIORIDADE_2,ESCOLA_URBANA_OU_SEDE,ARAPIRACA,ESCOLAR ANA BERNARDES SILVEIRA,ESCOLAR ANA BERNARDES SILVEIRA,SERRA DOS FERREIRA S/N,"SERRA DOS FERREIRA S/N, Arapiraca, Alagoas, Brasil",171,1.0,MATCH_FORTE,NAO_ENCONTRADO,,,,PENDENTE,,
PRIORIDADE_2,PRIORIDADE_2,VILA,MARECHAL DEODORO,ESCOLA MUNICIPAL ALTINA RIBEIRO TOLEDO,ESCOLA MUNICIPAL ALTINA RIBEIRO TOLEDO,VILA ALTINA SN,"VILA ALTINA SN, Marechal Deodoro, Alagoas, Brasil",168,1.0,MATCH_FORTE,NAO_ENCONTRADO,,,,PENDENTE,,
PRIORIDADE_2,PRIORIDADE_2,CONJUNTO_HABITACIONAL,RIO LARGO,ESCOLA PREFEITO WALTER DORIA DE FIGUEIREDO,ESCOLA PREFEITO WALTER DORIA DE FIGUEIREDO,"CJ MARIO MAFRA, QUADRA D-04","CJ MARIO MAFRA, QUADRA D-04, Rio Largo, Alagoas, Brasil",166,1.0,MATCH_FORTE,NAO_ENCONTRADO,,,,PENDENTE,,
PRIORIDADE_2,PRIORIDADE_2,CONJUNTO_HABITACIONAL,MACEIO,E.E. MANUEL BALTAZAR P. DIEGUES JUNIOR,E.E. MANUEL BALTAZAR P. DIEGUES JUNIOR,"CONJUNTO SANTA MARIA, S/N - RUA D QD 8","CONJUNTO SANTA MARIA, S/N - RUA D QD 8, Maceio, Alagoas, Brasil",164,1.0,MATCH_FORTE,NAO_ENCONTRADO,,,,PENDENTE,,
PRIORIDADE_2,PRIORIDADE_2,CONJUNTO_HABITACIONAL,RIO LARGO,CRECHE MUNICIPAL CELYRIO ADAMASTOR BARRETO ACIOLY,CRECHE MUNICIPAL CELYRIO ADAMASTOR BARRETO ACIOLY,"ROD AL 210, CJ EDSON NOVAES S/N","ROD AL 210, CJ EDSON NOVAES S/N, Rio Largo, Alagoas, Brasil",161,1.0,MATCH_FORTE,NAO_ENCONTRADO,,,,PENDENTE,,
PRIORIDADE_2,PRIORIDADE_2,ESCOLA_URBANA_OU_SEDE,MACEIO,COLÉGIO BRASIL (ANTIGO ISAAC NEWTON),COLEGIO BRASIL (ANTIGO ISAAC NEWTON),"RUA FERNANDO MENDES PINTO, N 11","RUA FERNANDO MENDES PINTO, N 11, Maceio, Alagoas, Brasil",159,1.0,MATCH_FORTE,NAO_ENCONTRADO,,,,PENDENTE,,
PRIORIDADE_2,PRIORIDADE_2,CONJUNTO_HABITACIONAL,MACEIO,E.M. GASTONE LÚCIA DE CARVALHO BELTRÃO,E.M. GASTONE LUCIA DE CARVALHO BELTRAO,"CONJ. JARDIM ROYAL - MODULO II - QD Q, S/N","CONJ. JARDIM ROYAL - MODULO II - QD Q, S/N, Maceio, Alagoas, Brasil",159,1.0,MATCH_FORTE,NAO_ENCONTRADO,,,,PENDENTE,,
PRIORIDADE_2,PRIORIDADE_2,ENDERECO_URBANO,MACEIO,EDIFÍCIO DO SENAC,EDIFICIO DO SENAC,"AV. PEDRO PAULINO, 77","AV. PEDRO PAULINO, 77, Maceio, Alagoas, Brasil",158,1.0,MATCH_FORTE,NAO_ENCONTRADO,,,,PENDENTE,,
PRIORIDADE_2,PRIORIDADE_2,ESCOLA_URBANA_OU_SEDE,RIO LARGO,GRUPO ESCOLAR DALMARIO DE SOUZA,GRUPO ESCOLAR DALMARIO DE SOUZA,RUA ALTO DA SAUDADE SN,"RUA ALTO DA SAUDADE SN, Rio Largo, Alagoas, Brasil",156,1.0,MATCH_FORTE,NAO_ENCONTRADO,,,,PENDENTE,,
PRIORIDADE_2,PRIORIDADE_2,ESCOLA_URBANA_OU_SEDE,SAO MIGUEL DOS CAMPOS,ESCOLA MUNICIPAL DIONISIA APRATTO TENORIO,ESCOLA MUNICIPAL DIONISIA APRATTO TENORIO,"AV. PREFEITO PEDRO FERNANDES, S/N","AV. PREFEITO PEDRO FERNANDES, S/N, Sao Miguel Dos Campos, Alagoas, Brasil",156,1.0,MATCH_FORTE,NAO_ENCONTRADO,,,,PENDENTE,,
PRIORIDADE_2,PRIORIDADE_2,ESCOLA_URBANA_OU_SEDE,SAO MIGUEL DOS CAMPOS,ESCOLA DE EDUCAÇÃO BÁSICA CONSTRUTIVISTA,ESCOLA DE EDUCACAO BASICA CONSTRUTIVISTA,"RUA PROJETADA, 16","RUA PROJETADA, 16, Sao Miguel Dos Campos, Alagoas, Brasil",155,1.0,MATCH_FORTE,NAO_ENCONTRADO,,,,PENDENTE,,
PRIORIDADE_2,PRIORIDADE_2,ENDERECO_URBANO,ARAPIRACA,CENTRO DE EDUCAÇÃO INFANTIL JOANNA DE ANGELLIS (ANTIGO MADRE PAULINA),CENTRO DE EDUCACAO INFANTIL JOANNA DE ANGELLIS (ANTIGO MADRE PAULINA),RUA DOMINGOS CORREIA 1065,"RUA DOMINGOS CORREIA 1065, Arapiraca, Alagoas, Brasil",154,1.0,MATCH_FORTE,NAO_ENCONTRADO,,,,PENDENTE,,
PRIORIDADE_2,PRIORIDADE_2,LOTEAMENTO,MARECHAL DEODORO,ESCOLA MUNICIPAL PREFEITO MANOEL MESSIAS DOS SANTOS,ESCOLA MUNICIPAL PREFEITO MANOEL MESSIAS DOS SANTOS,RUA SALVADOR S/N LOT. LUAR DO FRANCES,"RUA SALVADOR S/N LOT. LUAR DO FRANCÊS, Marechal Deodoro, Alagoas, Brasil",153,1.0,MATCH_FORTE,NAO_ENCONTRADO,,,,PENDENTE,,
PRIORIDADE_2,PRIORIDADE_2,ESCOLA_URBANA_OU_SEDE,MACEIO,ESC. MUN. PIO X (PRÉDIO DO ANTIGO COL.SAGRADA FAMÍLIA),ESC. MUN. PIO X (PREDIO DO ANTIGO COL.SAGRADA FAMILIA),"RUA PROFESSORA ZEZE LOUREIRO, 200","RUA PROFESSORA ZEZE LOUREIRO, 200, Maceio, Alagoas, Brasil",150,1.0,MATCH_FORTE,NAO_ENCONTRADO,,,,PENDENTE,,
PRIORIDADE_3,PRIORIDADE_3,ESCOLA_URBANA_OU_SEDE,MARECHAL DEODORO,ESCOLA MUNICIPAL MARIA PETRONILA DE GOUVEA,ESCOLA MUNICIPAL MARIA PETRONILA DE GOUVEA,RUA MARINITA DE GOUVEIA SN,"RUA MARINITA DE GOUVEIA SN, Marechal Deodoro, Alagoas, Brasil",149,1.0,MATCH_FORTE,NAO_ENCONTRADO,,,,PENDENTE,,
PRIORIDADE_3,PRIORIDADE_3,ESCOLA_URBANA_OU_SEDE,RIO LARGO,GRUPO ESCOLAR OZORIA MOURA DE LIMA,GRUPO ESCOLAR OZORIA MOURA DE LIMA,RUA ANTONIO ELIAS CALHEIROS S/N,"RUA ANTONIO ELIAS CALHEIROS S/N, Rio Largo, Alagoas, Brasil",147,1.0,MATCH_FORTE,NAO_ENCONTRADO,,,,PENDENTE,,
PRIORIDADE_3,PRIORIDADE_3,OUTROS,MACEIO,CLUBE DA CAIXA ECONÔMICA FEDERAL (APCEF/AL),CLUBE DA CAIXA ECONOMICA FEDERAL (APCEF/AL),"ROD. AL 101 NORTE, S/N","ROD. AL 101 NORTE, S/N, Maceio, Alagoas, Brasil",141,1.0,MATCH_FORTE,NAO_ENCONTRADO,,,,PENDENTE,,
PRIORIDADE_3,PRIORIDADE_3,CONJUNTO_HABITACIONAL,RIO LARGO,ESCOLA ESTADUAL JOÃO MORAIS CAVALCANTE,ESCOLA ESTADUAL JOAO MORAIS CAVALCANTE,"R. DO MATADOURO, CJ HAB JOSE FERNANDES TORRES, CJ MUTIRAO","R. DO MATADOURO, CJ HAB JOSE FERNANDES TORRES, CJ MUTIRÃO, Rio Largo, Alagoas, Brasil",141,1.0,MATCH_FORTE,NAO_ENCONTRADO,,,,PENDENTE,,
PRIORIDADE_3,PRIORIDADE_3,ENDERECO_URBANO,SAO MIGUEL DOS CAMPOS,CRECHE JOSEFA BENEDITA DOS SANTOS,CRECHE JOSEFA BENEDITA DOS SANTOS,AVENIDA PEDRO FERNANDES DE COSTA,"AVENIDA PEDRO FERNANDES DE COSTA, Sao Miguel Dos Campos, Alagoas, Brasil",141,1.0,MATCH_FORTE,NAO_ENCONTRADO,,,,PENDENTE,,
PRIORIDADE_3,PRIORIDADE_3,ESCOLA_URBANA_OU_SEDE,SAO MIGUEL DOS CAMPOS,COLÉGIO MUNICIPAL ESTHER SOARES TORRES,COLEGIO MUNICIPAL ESTHER SOARES TORRES,"AVENIDA PREFEITO PEDRO FERNANDES DA COSTA, S/N","AVENIDA PREFEITO PEDRO FERNANDES DA COSTA, S/N, Sao Miguel Dos Campos, Alagoas, Brasil",139,1.0,MATCH_FORTE,NAO_ENCONTRADO,,,,PENDENTE,,
PRIORIDADE_3,PRIORIDADE_3,ESCOLA_URBANA_OU_SEDE,SAO MIGUEL DOS CAMPOS,ESCOLA DE ENSINO SUPERIOR DE SAO MIGUEL DOS CAMPOS,ESCOLA DE ENSINO SUPERIOR DE SAO MIGUEL DOS CAMPOS,"PRACA SENHORA DOS PRAZERES, SN","PRACA SENHORA DOS PRAZERES, SN, Sao Miguel Dos Campos, Alagoas, Brasil",135,1.0,MATCH_FORTE,NAO_ENCONTRADO,,,,PENDENTE,,
PRIORIDADE_3,PRIORIDADE_3,ESCOLA_URBANA_OU_SEDE,RIO LARGO,GRUPO ESCOLAR PROFESSOR POMPEU SARMENTO,GRUPO ESCOLAR PROFESSOR POMPEU SARMENTO,TRAV SANTA LUZIA S/N,"TRAV SANTA LUZIA S/N, Rio Largo, Alagoas, Brasil",132,1.0,MATCH_FORTE,NAO_ENCONTRADO,,,,PENDENTE,,
PRIORIDADE_3,PRIORIDADE_3,ENDERECO_URBANO,CORURIPE,CENTRO EDUCACIONAL PROFISSIONAL MARIA ALICE BELTRÃO DE CASTRO SIQUEIRA,CENTRO EDUCACIONAL PROFISSIONAL MARIA ALICE BELTRAO DE CASTRO SIQUEIRA,RUA PERNAMBUCO NOVO,"RUA PERNAMBUCO NOVO, Coruripe, Alagoas, Brasil",131,1.0,MATCH_FORTE,NAO_ENCONTRADO,,,,PENDENTE,,
PRIORIDADE_3,PRIORIDADE_3,LOTEAMENTO,MACEIO,ESCOLA MUN. DOM MIGUEL FENELON CÂMARA,ESCOLA MUN. DOM MIGUEL FENELON CAMARA,"LOTEAMENTO JARDIM PETROPOLIS II, SN, QD 26","LOTEAMENTO JARDIM PETROPOLIS II, SN, QD 26, Maceio, Alagoas, Brasil",130,1.0,MATCH_FORTE,NAO_ENCONTRADO,,,,PENDENTE,,
PRIORIDADE_3,PRIORIDADE_3,ESCOLA_URBANA_OU_SEDE,MACEIO,ESCOLA MUN. PROF. DERALDO CAMPOS,ESCOLA MUN. PROF. DERALDO CAMPOS,"RUA TENENTE MOISES S. FIRMINO, S/N","RUA TENENTE MOISÉS S. FIRMINO, S/N, Maceio, Alagoas, Brasil",129,1.0,MATCH_FORTE,NAO_ENCONTRADO,,,,PENDENTE,,
PRIORIDADE_3,PRIORIDADE_3,ESCOLA_URBANA_OU_SEDE,CORURIPE,ESCOLA MUNICIPAL MANOEL CECÍLIO DE JESUS,ESCOLA MUNICIPAL MANOEL CECILIO DE JESUS,"RUA DO JASMIM,","RUA DO JASMIM,, Coruripe, Alagoas, Brasil",128,1.0,MATCH_FORTE,NAO_ENCONTRADO,,,,PENDENTE,,
PRIORIDADE_3,PRIORIDADE_3,VILA,ARAPIRACA,GRUPO ESCOLAR CÔNEGO EPITÁCIO RODRIGUES,GRUPO ESCOLAR CONEGO EPITACIO RODRIGUES,VILA SAO FRANCISCO,"VILA SAO FRANCISCO, Arapiraca, Alagoas, Brasil",127,1.0,MATCH_FORTE,NAO_ENCONTRADO,,,,PENDENTE,,
